drop table if exists t1;
select floor(5.5),floor(-5.5);
FLOOR(5.5)	FLOOR(-5.5)
5	-6
explain select floor(5.5),floor(-5.5);
id	select_type	table	partitions	type	possible_keys	key	key_len	ref	rows	filtered	Extra
1	SIMPLE	NULL	NULL	NULL	NULL	NULL	NULL	NULL	NULL	NULL	No tables used
select ceiling(5.5),ceiling(-5.5);
CEILING(5.5)	CEILING(-5.5)
6	-5
explain select ceiling(5.5),ceiling(-5.5);
id	select_type	table	partitions	type	possible_keys	key	key_len	ref	rows	filtered	Extra
1	SIMPLE	NULL	NULL	NULL	NULL	NULL	NULL	NULL	NULL	NULL	No tables used
select truncate(52.64,1),truncate(52.64,2),truncate(52.64,-1),truncate(52.64,-2), truncate(-52.64,1),truncate(-52.64,-1);
TRUNCATE(52.64,1)	TRUNCATE(52.64,2)	TRUNCATE(52.64,-1)	TRUNCATE(52.64,-2)	TRUNCATE(-52.64,1)	TRUNCATE(-52.64,-1)
52.600000000000001	52.640000000000001	50	0	-52.600000000000001	-50
explain select truncate(52.64,1),truncate(52.64,2),truncate(52.64,-1),truncate(52.64,-2), truncate(-52.64,1),truncate(-52.64,-1);
id	select_type	table	partitions	type	possible_keys	key	key_len	ref	rows	filtered	Extra
1	SIMPLE	NULL	NULL	NULL	NULL	NULL	NULL	NULL	NULL	NULL	No tables used
select round(5.5),round(-5.5);
ROUND(5.5)	ROUND(-5.5)
6	-6
explain select round(5.5),round(-5.5);
id	select_type	table	partitions	type	possible_keys	key	key_len	ref	rows	filtered	Extra
1	SIMPLE	NULL	NULL	NULL	NULL	NULL	NULL	NULL	NULL	NULL	No tables used
select round(5.64,1),round(5.64,2),round(5.64,-1),round(5.64,-2);
ROUND(5.64,1)	ROUND(5.64,2)	ROUND(5.64,-1)	ROUND(5.64,-2)
5.6	5.64	10	0
select abs(-10), sign(-5), sign(5), sign(0);
ABS(-10)	SIGN(-5)	SIGN(5)	SIGN(0)
10	-1	1	0
explain select abs(-10), sign(-5), sign(5), sign(0);
id	select_type	table	partitions	type	possible_keys	key	key_len	ref	rows	filtered	Extra
1	SIMPLE	NULL	NULL	NULL	NULL	NULL	NULL	NULL	NULL	NULL	No tables used
select log(exp(10)),exp(log(sqrt(10))*2),log(-1),log(NULL),log(1,1),log(3,9),log(-1,2),log(NULL,2);
LOG(EXP(10))	EXP(LOG(SQRT(10)) * 2)	LOG(-1)	LOG(NULL)	LOG(1,1)	LOG(3,9)	LOG(-1,2)	LOG(NULL,2)
10	10.000000000000002	NULL	NULL	NULL	2	NULL	NULL
explain select log(exp(10)),exp(log(sqrt(10))*2),log(-1),log(NULL),log(1,1),log(3,9),log(-1,2),log(NULL,2);
id	select_type	table	partitions	type	possible_keys	key	key_len	ref	rows	filtered	Extra
1	SIMPLE	NULL	NULL	NULL	NULL	NULL	NULL	NULL	NULL	NULL	No tables used
select ln(exp(10)),exp(ln(sqrt(10))*2),ln(-1),ln(0),ln(NULL);
LN(EXP(10))	EXP(LN(SQRT(10)) * 2)	LN(-1)	LN(0)	LN(NULL)
10	10.000000000000002	NULL	NULL	NULL
explain select ln(exp(10)),exp(ln(sqrt(10))*2),ln(-1),ln(0),ln(NULL);
id	select_type	table	partitions	type	possible_keys	key	key_len	ref	rows	filtered	Extra
1	SIMPLE	NULL	NULL	NULL	NULL	NULL	NULL	NULL	NULL	NULL	No tables used
select log2(8),log2(15),log2(-2),log2(0),log2(NULL);
LOG2(8)	LOG2(15)	LOG2(-2)	LOG2(0)	LOG2(NULL)
3	3.906890595608519	NULL	NULL	NULL
explain select log2(8),log2(15),log2(-2),log2(0),log2(NULL);
id	select_type	table	partitions	type	possible_keys	key	key_len	ref	rows	filtered	Extra
1	SIMPLE	NULL	NULL	NULL	NULL	NULL	NULL	NULL	NULL	NULL	No tables used
select log10(100),log10(18),log10(-4),log10(0),log10(NULL);
LOG10(100)	LOG10(18)	LOG10(-4)	LOG10(0)	LOG10(NULL)
2	1.255272505103306	NULL	NULL	NULL
explain select log10(100),log10(18),log10(-4),log10(0),log10(NULL);
id	select_type	table	partitions	type	possible_keys	key	key_len	ref	rows	filtered	Extra
1	SIMPLE	NULL	NULL	NULL	NULL	NULL	NULL	NULL	NULL	NULL	No tables used
select pow(10,log10(10)),power(2,4);
POW(10,LOG10(10))	POWER(2,4)
10	16
explain select pow(10,log10(10)),power(2,4);
id	select_type	table	partitions	type	possible_keys	key	key_len	ref	rows	filtered	Extra
1	SIMPLE	NULL	NULL	NULL	NULL	NULL	NULL	NULL	NULL	NULL	No tables used
set @@rand_seed1=10000000,@@rand_seed2=1000000;
select rand(999999),rand();
RAND(999999)	RAND()
0.014231365187309	0.807856816619501
explain select rand(999999),rand();
id	select_type	table	partitions	type	possible_keys	key	key_len	ref	rows	filtered	Extra
1	SIMPLE	NULL	NULL	NULL	NULL	NULL	NULL	NULL	NULL	NULL	No tables used
select pi(),format(sin(pi()/2),6),format(cos(pi()/2),6),format(abs(tan(pi())),6),format(cot(1),6),format(asin(1),6),format(acos(0),6),format(atan(1),6);
PI()	FORMAT(SIN(PI() / 2),6)	FORMAT(COS(PI() / 2),6)	FORMAT(ABS(TAN(PI())),6)	FORMAT(COT(1),6)	FORMAT(ASIN(1),6)	FORMAT(ACOS(0),6)	FORMAT(ATAN(1),6)
3.141592653589793	1.000000	0.000000	0.000000	0.642093	1.570796	1.570796	0.785398
explain select pi(),format(sin(pi()/2),6),format(cos(pi()/2),6),format(abs(tan(pi())),6),format(cot(1),6),format(asin(1),6),format(acos(0),6),format(atan(1),6);
id	select_type	table	partitions	type	possible_keys	key	key_len	ref	rows	filtered	Extra
1	SIMPLE	NULL	NULL	NULL	NULL	NULL	NULL	NULL	NULL	NULL	No tables used
select degrees(pi()),radians(360);
DEGREES(PI())	RADIANS(360)
180	6.283185307179586
select format(atan(-2, 2), 6);
FORMAT(ATAN(-2,2),6)
-0.785398
select format(atan(pi(), 0), 6);
FORMAT(ATAN(PI(),0),6)
1.570796
select format(atan2(-2, 2), 6);
FORMAT(ATAN2(-2,2),6)
-0.785398
select format(atan2(pi(), 0), 6);
FORMAT(ATAN2(PI(),0),6)
1.570796
SELECT ACOS(1.0);
ACOS(1)
0
SELECT ASIN(1.0);
ASIN(1)
1.570796326794897
SELECT ACOS(0.2*5.0);
ACOS(0.2 * 5)
0
SELECT ACOS(0.5*2.0);
ACOS(0.5 * 2)
0
SELECT ASIN(0.8+0.2);
ASIN(0.8 + 0.2)
1.570796326794897
SELECT ASIN(1.2-0.2);
ASIN(1.2 - 0.2)
1.570796326794897
select format(4.55, 1), format(4.551, 1);
FORMAT(4.55,1)	FORMAT(4.551,1)
4.5	4.6
explain select degrees(pi()),radians(360);
id	select_type	table	partitions	type	possible_keys	key	key_len	ref	rows	filtered	Extra
1	SIMPLE	NULL	NULL	NULL	NULL	NULL	NULL	NULL	NULL	NULL	No tables used
select rand(rand);
ERROR 42S22: Column 'rand' not found
create table t1 (col1 int, col2 decimal(60,30));
insert into t1 values(1,1234567890.12345);
select format(col2,7) from t1;
FORMAT(col2,7)
1,234,567,890.1234500
select format(col2,8) from t1;
FORMAT(col2,8)
1,234,567,890.12345004
insert into t1 values(7,1234567890123456.12345);
select format(col2,6) from t1 where col1=7;
FORMAT(col2,6)
1,234,567,890,123,456.000000
drop table t1;
select ceil(0.09);
CEIL(0.09)
1
select ceil(0.000000000000000009);
CEIL(0.000000000000000009)
1
create table t1 select round(1, 6);
show create table t1;
Table	Create Table
t1	CREATE TABLE `t1` (
  `ROUND(1,6)` BIGINT NOT NULL
) ENGINE=RooDB DEFAULT CHARSET=utf8mb4
select * from t1;
ROUND(1,6)
1
drop table t1;
select abs(-2) * -2;
ABS(-2) * -2
-4
CREATE TABLE t1 (a INT);
INSERT INTO t1 VALUES (1),(1),(1),(2);
SELECT CAST(RAND(2) * 1000 AS UNSIGNED), CAST(RAND(a) * 1000 AS UNSIGNED)
FROM t1;
CAST(RAND(2) * 1000 AS unsigned)	CAST(RAND(a) * 1000 AS unsigned)
656	405
656	405
656	405
656	656
SELECT CAST(RAND(2) * 1000 AS UNSIGNED), CAST(RAND(a) * 1000 AS UNSIGNED)
FROM t1 WHERE a = 1;
CAST(RAND(2) * 1000 AS unsigned)	CAST(RAND(a) * 1000 AS unsigned)
656	405
656	405
656	405
INSERT INTO t1 VALUES (3);
SELECT CAST(RAND(2) * 1000 AS UNSIGNED), CAST(RAND(a) * 1000 AS UNSIGNED)
FROM t1;
CAST(RAND(2) * 1000 AS unsigned)	CAST(RAND(a) * 1000 AS unsigned)
656	405
656	405
656	405
656	656
656	906
SELECT CAST(RAND(2) * 1000 AS UNSIGNED), CAST(RAND(a) * 1000 AS UNSIGNED)
FROM t1 WHERE a = 1;
CAST(RAND(2) * 1000 AS unsigned)	CAST(RAND(a) * 1000 AS unsigned)
656	405
656	405
656	405
PREPARE stmt FROM "SELECT CAST(RAND(2) * 1000 AS UNSIGNED), CAST(RAND(?) * 1000 AS UNSIGNED) FROM t1 WHERE a = 1";
set @var=2;
EXECUTE stmt USING @var;
CAST(RAND(2) * 1000 AS unsigned)	CAST(RAND(2) * 1000 AS unsigned)
656	656
656	656
656	656
DROP TABLE t1;
SET timestamp=UNIX_TIMESTAMP('2001-01-01 00:00:00');
create table t1 (a varchar(90), ts datetime not null, index (a)) engine=innodb default charset=utf8;
insert into t1 values ('http://www.foo.com/', now());
select a from t1 where a='http://www.foo.com/' order by abs(timediff(ts, 0));
a
http://www.foo.com/
drop table t1;
SET timestamp=DEFAULT;
set sql_mode='traditional';
select ln(-1);
LN(-1)
NULL
select log10(-1);
LOG10(-1)
NULL
select log2(-1);
LOG2(-1)
NULL
select log(2,-1);
LOG(2,-1)
NULL
select log(-2,1);
LOG(-2,1)
NULL
set sql_mode='';
select round(111,-10);
ROUND(111,-10)
0
select round(-5000111000111000155,-1);
ROUND(-5000111000111000155,-1)
-5000111000111000160
select round(15000111000111000155,-1);
ROUND(15000111000111000155,-1)
15000111000111000160
select truncate(-5000111000111000155,-1);
TRUNCATE(-5000111000111000155,-1)
-5.000111000111001e18
select truncate(15000111000111000155,-1);
TRUNCATE(15000111000111000155,-1)
1.5000111000111002e19
set names utf8;
create table t1
(f1 varchar(32) not null,
f2 smallint(5) unsigned not null,
f3 int(10) unsigned not null default '0')
default charset=utf8;
insert into t1 values ('zombie',0,0),('gold',1,10000),('silver',2,10000);
create table t2
(f1 int(10) unsigned not null,
f2 int(10) unsigned not null,
f3 smallint(5) unsigned not null)
default charset=utf8;
insert into t2 values (16777216,16787215,1),(33554432,33564431,2);
select format(t2.f2-t2.f1+1,0) from t1,t2
where t1.f2 = t2.f3 order by t1.f1;
FORMAT(f2 - f1 + 1,0)
10,000
10,000
drop table t1, t2;
set names default;
select cast(-2 as unsigned), 18446744073709551614, -2;
CAST(-2 AS unsigned)	18446744073709551614	-2
18446744073709551614	18446744073709551614	-2
select abs(cast(-2 as unsigned)), abs(18446744073709551614), abs(-2);
ABS(CAST(-2 AS unsigned))	ABS(18446744073709551614)	ABS(-2)
18446744073709551614	18446744073709551614	2
select ceiling(cast(-2 as unsigned)), ceiling(18446744073709551614), ceiling(-2);
CEILING(CAST(-2 AS unsigned))	CEILING(18446744073709551614)	CEILING(-2)
18446744073709551614	18446744073709551614	-2
select floor(cast(-2 as unsigned)), floor(18446744073709551614), floor(-2);
FLOOR(CAST(-2 AS unsigned))	FLOOR(18446744073709551614)	FLOOR(-2)
18446744073709551614	18446744073709551614	-2
select format(cast(-2 as unsigned), 2), format(18446744073709551614, 2), format(-2, 2);
FORMAT(CAST(-2 AS unsigned),2)	FORMAT(18446744073709551614,2)	FORMAT(-2,2)
18,446,744,073,709,551,616.00	18,446,744,073,709,551,616.00	-2.00
select sqrt(cast(-2 as unsigned)), sqrt(18446744073709551614), sqrt(-2);
SQRT(CAST(-2 AS unsigned))	SQRT(18446744073709551614)	SQRT(-2)
4294967296	4294967296	NaN
select round(cast(-2 as unsigned), 1), round(18446744073709551614, 1), round(-2, 1);
ROUND(CAST(-2 AS unsigned),1)	ROUND(18446744073709551614,1)	ROUND(-2,1)
1.8446744073709552e19	1.8446744073709552e19	-2
select round(4, cast(-2 as unsigned)), round(4, 18446744073709551614), round(4, -2);
ROUND(4,CAST(-2 AS unsigned))	ROUND(4,18446744073709551614)	ROUND(4,-2)
0	0	0
select truncate(cast(-2 as unsigned), 1), truncate(18446744073709551614, 1), truncate(-2, 1);
TRUNCATE(CAST(-2 AS unsigned),1)	TRUNCATE(18446744073709551614,1)	TRUNCATE(-2,1)
1.8446744073709552e19	1.8446744073709552e19	-2
select truncate(4, cast(-2 as unsigned)), truncate(4, 18446744073709551614), truncate(4, -2);
TRUNCATE(4,CAST(-2 AS unsigned))	TRUNCATE(4,18446744073709551614)	TRUNCATE(4,-2)
0	0	0
select round(10000000000000000000, -19), truncate(10000000000000000000, -19);
ROUND(10000000000000000000,-19)	TRUNCATE(10000000000000000000,-19)
10000000000000000000	1e19
select round(1e0, -309), truncate(1e0, -309);
ROUND(1,-309)	TRUNCATE(1,-309)
0	NaN
select round(1e1,308), truncate(1e1, 308);
ROUND(10,308)	TRUNCATE(10,308)
inf	inf
select round(1e1, 2147483648), truncate(1e1, 2147483648);
ROUND(10,2147483648)	TRUNCATE(10,2147483648)
0	NaN
select round(1.1e1, 4294967295), truncate(1.1e1, 4294967295);
ROUND(11,4294967295)	TRUNCATE(11,4294967295)
10	10
select round(1.12e1, 4294967296), truncate(1.12e1, 4294967296);
ROUND(11.2,4294967296)	TRUNCATE(11.2,4294967296)
11	11
select round(1.5, 2147483640), truncate(1.5, 2147483640);
ROUND(1.5,2147483640)	TRUNCATE(1.5,2147483640)
0	NaN
select round(1.5, -2147483649), round(1.5, 2147483648);
ROUND(1.5,-2147483649)	ROUND(1.5,2147483648)
0	0
select truncate(1.5, -2147483649), truncate(1.5, 2147483648);
TRUNCATE(1.5,-2147483649)	TRUNCATE(1.5,2147483648)
NaN	NaN
select round(1.5, -4294967296), round(1.5, 4294967296);
ROUND(1.5,-4294967296)	ROUND(1.5,4294967296)
2	2
select truncate(1.5, -4294967296), truncate(1.5, 4294967296);
TRUNCATE(1.5,-4294967296)	TRUNCATE(1.5,4294967296)
1	1
select round(1.5, -9223372036854775808), round(1.5, 9223372036854775808);
ROUND(1.5,-9223372036854775808)	ROUND(1.5,9223372036854775808)
2	2
select truncate(1.5, -9223372036854775808), truncate(1.5, 9223372036854775808);
TRUNCATE(1.5,-9223372036854775808)	TRUNCATE(1.5,9223372036854775808)
1	1
select round(1.5, 18446744073709551615), truncate(1.5, 18446744073709551615);
ROUND(1.5,18446744073709551615)	TRUNCATE(1.5,18446744073709551615)
0	0
select round(18446744073709551614, -1), truncate(18446744073709551614, -1);
ROUND(18446744073709551614,-1)	TRUNCATE(18446744073709551614,-1)
0	1.8446744073709552e19
select round(4, -4294967200), truncate(4, -4294967200);
ROUND(4,-4294967200)	TRUNCATE(4,-4294967200)
0	4
select mod(cast(-2 as unsigned), 3), mod(18446744073709551614, 3), mod(-2, 3);
MOD(CAST(-2 AS unsigned),3)	MOD(18446744073709551614,3)	MOD(-2,3)
2	2	-2
select mod(5, cast(-2 as unsigned)), mod(5, 18446744073709551614), mod(5, -2);
MOD(5,CAST(-2 AS unsigned))	MOD(5,18446744073709551614)	MOD(5,-2)
5	5	1
select pow(cast(-2 as unsigned), 5), pow(18446744073709551614, 5), pow(-2, 5);
POW(CAST(-2 AS unsigned),5)	POW(18446744073709551614,5)	POW(-2,5)
2.13598703592091e96	2.13598703592091e96	-32
CREATE TABLE t1 (a timestamp, b varchar(20), c bit(1));
INSERT INTO t1 VALUES('1998-09-23', 'str1', 1), ('2003-03-25', 'str2', 0);
SELECT a DIV 900 y FROM t1 GROUP BY y;
y
2
SELECT DISTINCT a DIV 900 y FROM t1;
y
2
SELECT b DIV 900 y FROM t1 GROUP BY y;
y
0
SELECT c DIV 900 y FROM t1 GROUP BY y;
y
0
DROP TABLE t1;
CREATE TABLE t1(a LONGBLOB);
INSERT INTO t1 VALUES('1'),('2'),('3');
SELECT DISTINCT (a DIV 254576881) FROM t1;
a DIV 254576881
0
SELECT (a DIV 254576881) FROM t1 UNION ALL 
SELECT (a DIV 254576881) FROM t1;
a DIV 254576881
0
0
0
0
0
0
DROP TABLE t1;
CREATE TABLE t1(a SET('a','b','c'));
INSERT INTO t1 VALUES ('a');
SELECT a DIV 2 FROM t1 UNION SELECT a DIV 2 FROM t1;
a DIV 2
0
DROP TABLE t1;
CREATE TABLE t1 (a DOUBLE);
INSERT INTO t1 VALUES (-1.1), (1.1),
(-1.5), (1.5),
(-1.9), (1.9),
(-2.1), (2.1),
(-2.5), (2.5),
(-2.9), (2.9),
# Check numbers with absolute values > 2^53 - 1 
# (see comments for MAX_EXACT_INTEGER)
(-1e16 - 0.5), (1e16 + 0.5),
(-1e16 - 1.5), (1e16 + 1.5);
SELECT a, ROUND(a) FROM t1;
a	ROUND(a)
-1.1	-1
1.1	1
-1.5	-2
1.5	2
-1.9	-2
1.9	2
-2.1	-2
2.1	2
-2.5	-3
2.5	3
-2.9	-3
2.9	3
-1e16	-10000000000000000
1e16	10000000000000000
-1.0000000000000002e16	-10000000000000002
1.0000000000000002e16	10000000000000002
DROP TABLE t1;
CREATE TABLE t1(f1 LONGTEXT);
INSERT INTO t1 VALUES ('a');
SELECT 1 FROM (SELECT ROUND(f1) AS a FROM t1) AS s WHERE a LIKE 'a';
1
SELECT 1 FROM (SELECT ROUND(f1, f1) AS a FROM t1) AS s WHERE a LIKE 'a';
1
DROP TABLE t1;
End of 5.0 tests
SELECT 1e308 + 1e308;
ERROR 22003: DOUBLE value is out of range
SELECT -1e308 - 1e308;
ERROR 22003: DOUBLE value is out of range
SELECT 1e300 * 1e300;
ERROR 22003: DOUBLE value is out of range
SELECT 1e300 / 1e-300;
ERROR 22003: DOUBLE value is out of range
SELECT EXP(750);
ERROR 22003: DOUBLE value is out of range
SELECT POW(10, 309);
ERROR 22003: DOUBLE value is out of range
#
# Bug #44768: SIGFPE crash when selecting rand from a view
#             containing null
#
CREATE OR REPLACE VIEW v1 AS SELECT NULL AS a;
SELECT RAND(a) FROM v1;
RAND(a)
0.155220427694936
DROP VIEW v1;
SELECT RAND(a) FROM (SELECT NULL AS a) b;
RAND(a)
0.155220427694936
CREATE TABLE t1 (i INT);
INSERT INTO t1 VALUES (NULL);
SELECT RAND(i) FROM t1;
RAND(i)
0.155220427694936
DROP TABLE t1;
#
# Bug#57477 SIGFPE when dividing a huge number a negative number
#
SELECT -9999999999999999991 DIV -1;
ERROR 22003: BIGINT value is out of range
SELECT -9223372036854775808 DIV -1;
ERROR 22003: BIGINT value is out of range
SELECT -9223372036854775808 MOD -1;
-9223372036854775808 % -1
0
SELECT -9223372036854775808999 MOD -1;
-9223372036854775808999 % -1
0
select 123456789012345678901234567890.123456789012345678901234567890 div 1 as x;
ERROR 22003: BIGINT value is out of range
select "123456789012345678901234567890.123456789012345678901234567890" div 1 as x;
ERROR 22003: BIGINT value is out of range
SHOW WARNINGS;
Level	Code	Message
#
# Bug#57810 case/when/then : Assertion failed: length || !scale
#
SELECT CASE(('')) WHEN (CONVERT(1, CHAR(1))) THEN (('' / 1)) END;
CASE
NULL
CREATE TABLE t1 SELECT CAST((CASE(('')) WHEN (CONVERT(1, CHAR(1))) THEN (('' / 1)) END) AS CHAR) as C;
SHOW CREATE TABLE t1;
Table	Create Table
t1	CREATE TABLE `t1` (
  `C` VARCHAR(1)
) ENGINE=RooDB DEFAULT CHARSET=utf8mb4
DROP TABLE t1;
# Bug#11764994  57900: CREATE TABLE .. SELECT ASSERTS SCALE >= 0 && PRECISION > 0 && SCALE <= PR
#
CREATE TABLE t1 SELECT CEIL(ST_LINESTRINGFROMWKB(1) DIV NULL);
ERROR HY000: invalid operation: Incorrect arguments to DIV
DROP TABLE IF EXISTS t1;
CREATE TABLE t1 SELECT FLOOR(ST_LINESTRINGFROMWKB(1) DIV NULL);
ERROR HY000: invalid operation: Incorrect arguments to DIV
DROP TABLE IF EXISTS t1;
#
# Bug#11765923  58937: MANY VALGRIND ERRORS AFTER GROUPING BY RESULT OF DECIMAL COLUMN FUNCTION
#
CREATE TABLE t1(f1 DECIMAL(22,1));
INSERT INTO t1 VALUES (0),(1);
SELECT ROUND(f1, f1) FROM t1;
ROUND(f1,f1)
0
1
SELECT ROUND(f1, f1) FROM t1 GROUP BY 1;
ROUND(f1,f1)
1
DROP TABLE t1;
#
# Bug#11764671  57533: UNINITIALISED VALUES IN COPY_AND_CONVERT (SQL_STRING.CC) WITH CERTAIN CHA
#
SELECT ROUND(LEAST(15, -4939092, 0.2704), STDDEV('a'));
ROUND(LEAST(15,-4939092,0.2704),STDDEV('a'))
-4939092
#
# Bug#12392636  ASSERTION FAILED: SCALE >= 0 && PRECISION > 0 && SCALE <= PRECISION
#
SELECT SUM(DISTINCT (TRUNCATE((.1), NULL)));
SUM(TRUNCATE(0.1,NULL))
0
End of 5.1 tests
#
# Bug #8433: Overflow must be an error
#
SELECT 1e308 + 1e308;
ERROR 22003: DOUBLE value is out of range
SELECT -1e308 - 1e308;
ERROR 22003: DOUBLE value is out of range
SELECT 1e300 * 1e300;
ERROR 22003: DOUBLE value is out of range
SELECT 1e300 / 1e-300;
ERROR 22003: DOUBLE value is out of range
SELECT EXP(750);
ERROR 22003: DOUBLE value is out of range
SELECT POW(10, 309);
ERROR 22003: DOUBLE value is out of range
SELECT COT(0);
ERROR 22003: DOUBLE value is out of range in 'cot'
SELECT DEGREES(1e307);
ERROR 22003: DOUBLE value is out of range
SELECT 9223372036854775808 + 9223372036854775808;
ERROR 22003: BIGINT UNSIGNED value is out of range
SELECT 18446744073709551615 + 1;
ERROR 22003: BIGINT UNSIGNED value is out of range
SELECT 1 + 18446744073709551615;
ERROR 22003: BIGINT UNSIGNED value is out of range
SELECT -2 + CAST(1 AS UNSIGNED);
ERROR 22003: BIGINT UNSIGNED value is out of range
SELECT CAST(1 AS UNSIGNED) + -2;
ERROR 22003: BIGINT UNSIGNED value is out of range
SELECT -9223372036854775808 + -9223372036854775808;
ERROR 22003: BIGINT value is out of range
SELECT 9223372036854775807 + 9223372036854775807;
ERROR 22003: BIGINT value is out of range
SELECT CAST(0 AS UNSIGNED) - 9223372036854775809;
ERROR 22003: BIGINT UNSIGNED value is out of range
SELECT 9223372036854775808 - 9223372036854775809;
ERROR 22003: BIGINT UNSIGNED value is out of range
SELECT CAST(1 AS UNSIGNED) - 2;
ERROR 22003: BIGINT UNSIGNED value is out of range
SELECT 18446744073709551615 - (-1);
ERROR 22003: BIGINT UNSIGNED value is out of range
SELECT -1 - 9223372036854775808;
ERROR 22003: BIGINT UNSIGNED value is out of range
SELECT -1 - CAST(1 AS UNSIGNED);
ERROR 22003: BIGINT UNSIGNED value is out of range
SELECT -9223372036854775808 - 1;
ERROR 22003: BIGINT value is out of range
SELECT 9223372036854775807 - -9223372036854775808;
ERROR 22003: BIGINT value is out of range
set SQL_MODE='NO_UNSIGNED_SUBTRACTION';
SELECT 18446744073709551615 - 1;
ERROR 22003: BIGINT value is out of range
SELECT 18446744073709551615 - CAST(1 AS UNSIGNED);
ERROR 22003: BIGINT value is out of range
SELECT 18446744073709551614 - (-1);
ERROR 22003: BIGINT value is out of range
SELECT 9223372036854775807 - -1;
ERROR 22003: BIGINT value is out of range
set SQL_MODE=default;
SELECT 4294967296 * 4294967296;
ERROR 22003: BIGINT value is out of range
SELECT 9223372036854775808 * 2;
ERROR 22003: BIGINT UNSIGNED value is out of range
SELECT 9223372036854775808 * 2;
ERROR 22003: BIGINT UNSIGNED value is out of range
SELECT 7158278827 * 3221225472;
ERROR 22003: BIGINT value is out of range
SELECT 9223372036854775807 * (-2);
ERROR 22003: BIGINT value is out of range
SELECT CAST(1 as UNSIGNED) * (-1);
ERROR 22003: BIGINT UNSIGNED value is out of range
SELECT 9223372036854775807 * 2;
ERROR 22003: BIGINT value is out of range
SELECT ABS(-9223372036854775808);
ERROR 22003: BIGINT value is out of range
SELECT -9223372036854775808 DIV -1;
ERROR 22003: BIGINT value is out of range
SELECT 18446744073709551615 DIV -1;
ERROR 22003: BIGINT value is out of range
CREATE TABLE t1(a BIGINT, b BIGINT UNSIGNED);
INSERT INTO t1 VALUES(-9223372036854775808, 9223372036854775809);
SELECT -a FROM t1;
ERROR 22003: BIGINT value is out of range
SELECT -b FROM t1;
ERROR 22003: BIGINT value is out of range
DROP TABLE t1;
SET @a:=999999999999999999999999999999999999999999999999999999999999999999999999999999999;
SELECT @a + @a;
ERROR 22003: BIGINT UNSIGNED value is out of range
SELECT @a * @a;
ERROR 22003: BIGINT UNSIGNED value is out of range
SELECT -@a - @a;
ERROR 22003: BIGINT UNSIGNED value is out of range
SELECT @a / 0.5;
ERROR 22003: BIGINT UNSIGNED value is out of range
SELECT COT(1/0);
COT(1 / 0)
NULL
SELECT -1 + 9223372036854775808;
-1 + 9223372036854775808
9223372036854775807
SELECT 2 DIV -2;
2 DIV -2
-1
SELECT -(1 DIV 0);
-1 DIV 0
NULL
SELECT -9223372036854775808 MOD -1;
-9223372036854775808 % -1
0
#
# Bug #57209 valgrind + Assertion failed: dst > buf 
#
SELECT floor(log10(format(concat_ws(5445796E25, 5306463, 30837), -358821)))
as foo;
foo
NULL
#
# Bug #58137 char(0) column cause:
#            my_gcvt: Assertion `width > 0 && to != ((void *)0)' failed
#
CREATE TABLE t1(a char(0));
INSERT IGNORE INTO t1 (SELECT -pi());
DROP TABLE t1;
#
# Bug #59241 invalid memory read
#            in do_div_mod with doubly assigned variables
#
#
# Bug #59498 div function broken in mysql-trunk
#
SELECT 1 div null;
1 DIV NULL
NULL
#
# Bug #11792200 - DIVIDING LARGE NUMBERS CAUSES STACK CORRUPTIONS
#
select (1.175494351E-37 div 1.7976931348623157E+308);
0.0000000000000000000000000000000000001175494351 DIV 179769313486231570000000000000000000000000000000000000000000000000000000000000000000000000000000000000000000000000000000000000000000000000000000000000000000000000000000000000000000000000000000000000000000000000000000000000000000000000000000000000000000000000000000000000000000000000000000000000000000000000000
0
#
# Bug#12744991 - DECIMAL_ROUND(X,D) GIVES WRONG RESULTS WHEN D == N*(-9)
#
select round(999999999, -9);
ROUND(999999999,-9)
1000000000
select round(999999999.0, -9);
ROUND(999999999,-9)
999999999
select round(999999999999999999, -18);
ROUND(999999999999999999,-18)
1000000000000000000
select round(999999999999999999.0, -18);
ROUND(1000000000000000000,-18)
999999999999999872
#
# Bug#12537160 ASSERTION FAILED:
# STOP0 <= &TO->BUF[TO->LEN] WITH LARGE NUMBER.
#
select 999999999999999999999999999999999999999999999999999999999999999999999999999999999 % 0.1 as foo;
foo
0.072890102838474
select 999999999999999999999999999999999999999999999999999999999999999999999999999999999 % 0.0 as foo;
foo
NULL
#
# Bug#12711164 - 61676:
# RESULT OF DIV WITH DECIMAL AND INTEGER DOES NOT MAKE SENSE 
#
select 5 div 2;
5 DIV 2
2
select 5.0 div 2.0;
5 DIV 2
2
select 5.0 div 2;
5 DIV 2
2
select 5 div 2.0;
5 DIV 2
2
select 5.9 div 2, 1.23456789e3 DIV 2, 1.23456789e9 DIV 2, 1.23456789e19 DIV 2;
5.9 DIV 2	1234.56789 DIV 2	1234567890 DIV 2	12345678900000000000 DIV 2
2	617	617283945	6172839450000000000
#
# Bug#11758319 BEHAVIOR OF LOGARITHMIC FUNCTIONS DEPENDS ON
#              ERROR_FOR_DIVISION_BY_ZERO
# Bug#50507 Behavior of logarithmic functions depends on
#              ERROR_FOR_DIVISION_BY_ZERO
CREATE TABLE t1(a DOUBLE);
SET sql_mode='';
INSERT INTO t1 VALUES (ln(1));
INSERT INTO t1 VALUES (ln(0));
INSERT INTO t1 VALUES (ln(-1));
INSERT INTO t1 VALUES (log(0));
INSERT INTO t1 VALUES (log(1,0));
INSERT INTO t1 VALUES (log2(0));
INSERT INTO t1 VALUES (log10(0));
SELECT * FROM t1 ORDER BY a;
a
NULL
NULL
NULL
NULL
NULL
NULL
0
SET sql_mode=default;
INSERT INTO t1 VALUES (ln(1));
INSERT INTO t1 VALUES (ln(0));
ERROR 2201E: Invalid argument for logarithm in function ln
INSERT INTO t1 VALUES (ln(-1));
ERROR 2201E: Invalid argument for logarithm in function ln
INSERT INTO t1 VALUES (log(0));
ERROR 2201E: Invalid argument for logarithm in function log
INSERT INTO t1 VALUES (log(1,0));
ERROR 2201E: Invalid argument for logarithm in function log
INSERT INTO t1 VALUES (log2(0));
ERROR 2201E: Invalid argument for logarithm in function log2
INSERT INTO t1 VALUES (log10(0));
ERROR 2201E: Invalid argument for logarithm in function log10
SELECT * FROM t1 ORDER BY a;
a
NULL
NULL
NULL
NULL
NULL
NULL
0
0
UPDATE t1 SET a = ln(0);
ERROR 2201E: Invalid argument for logarithm in function ln
SELECT * FROM t1 ORDER BY a;
a
NULL
NULL
NULL
NULL
NULL
NULL
0
0
SET sql_mode='';
UPDATE t1 SET a = ln(0);
SELECT * FROM t1 ORDER BY a;
a
NULL
NULL
NULL
NULL
NULL
NULL
NULL
NULL
SET sql_mode=default;
DELETE FROM t1 WHERE a <=> ln(0);
ERROR 2201E: Invalid argument for logarithm in function ln
SELECT * FROM t1 ORDER BY a;
a
NULL
NULL
NULL
NULL
NULL
NULL
NULL
NULL
SET sql_mode='';
DELETE FROM t1 WHERE a <=> ln(0);
SELECT * FROM t1 ORDER BY a;
a
DROP TABLE t1;
SET sql_mode=default;
#
# Bug#19047527 SQRT() : UNINITIALISED VALUE IN MY_STRTOD
#
do sqrt(weight_string(_eucjpms "0E+"));
#
# Bug#21279005 - ROUND FUNCTION INCORRECT IN WHERE-CLAUSE
#                USING LOCAL VARIABLE
#
# Bug#23013359 FUNCTION FLOOR(CEIL()) TRUNCATES BIGINT UNSIGNED
#
SELECT floor(ceil(12345678901234567890));
FLOOR(CEIL(12345678901234567890))
12345678901234567890
SELECT floor(18446744073709551616);
FLOOR(18446744073709551616)
18446744073709551616
SELECT floor(floor(18446744073709551616));
FLOOR(FLOOR(18446744073709551616))
18446744073709551616
SELECT floor(floor(floor(18446744073709551616)));
FLOOR(FLOOR(FLOOR(18446744073709551616)))
18446744073709551616
# Bug#25669580: regression: assertion failed: 0 in Item_num_func1::str_op
DO ROUND(0xe9b1, NULL);
# Bug#25688504: regression: scale >= 0 && precision >= 0 && ...
DO COUNT(DISTINCT ROUND(CAST(SLEEP(0) AS DECIMAL), NULL));
#
# Bug#26495791 - EXPAND TEST SUITE TO INCLUDE CRC32 TESTS
#
SELECT CRC32(NULL), CRC32(''), CRC32('MySQL'), CRC32('mysql');
CRC32(NULL)	CRC32('')	CRC32('MySQL')	CRC32('mysql')
NULL	0	3259397556	2501908538
SELECT CRC32('01234567'), CRC32('012345678');
CRC32('01234567')	CRC32('012345678')
763378421	939184570
SELECT CRC32('~!@$%^*'),  CRC32('-0.0001');
CRC32('~NOT @$%^*')	CRC32('-0.0001')
2339848252	324352530
SELECT CRC32(99999999999999999999999999999999);
CRC32(99999999999999999999999999999999)
3035957051
SELECT CRC32(-99999999999999999999999999999999);
CRC32(-99999999999999999999999999999999)
1052326872
DROP TABLE IF EXISTS t;
CREATE TABLE t(a INT, b VARCHAR(2));
INSERT INTO t VALUES (1,'a'), (2,'qw'), (1,'t'), (3,'t');
SELECT crc32(SUM(a)) FROM t;
CRC32(SUM(a))
4089123719
SELECT crc32(AVG(a)) FROM t GROUP BY b ORDER BY crc32(AVG(a));
CRC32(AVG(a))
4117811564
4117811564
4147539765
SELECT crc32(MAX(b)) FROM t GROUP BY a ORDER BY crc32(MAX(b));
CRC32(MAX(b))
2238339752
2238339752
3114057431
SELECT a, b, crc32(a) FROM t GROUP BY a,b HAVING crc32(MAX(a))=450215437;
a	b	CRC32(a)
2	qw	450215437
SELECT a,b,concat(a,b),crc32(concat(a,b)) FROM t ORDER BY crc32(concat(a,b));
a	b	CONCAT(a,b)	CRC32(CONCAT(a,b))
2	qw	2qw	552289476
1	a	1a	3174122627
1	t	1t	3505168488
3	t	3t	3805987562
DROP TABLE t;
SELECT CRC32(4+2);
CRC32(4 + 2)
498629140
SELECT CRC32(4/2);
CRC32(4 / 2)
4117811564
SELECT CRC32(4-2);
CRC32(4 - 2)
450215437
SELECT CRC32(4*2);
CRC32(4 * 2)
4194326291
SELECT CRC32(ABS(-6));
CRC32(ABS(-6))
498629140
SELECT CRC32(CEILING(1.23));
CRC32(CEILING(1.23))
450215437
SELECT CRC32(FLOOR(1.23));
CRC32(FLOOR(1.23))
2212294583
SELECT CRC32(LOG(10,100));
CRC32(LOG(10,100))
4117811564
SELECT CRC32(PI());
CRC32(PI())
3949001113
SELECT CRC32(POWER(2,2));
CRC32(POWER(2,2))
4059934174
SELECT CRC32(ROUND(1.58));
CRC32(ROUND(1.58))
450215437
SELECT CRC32(SIGN(0));
CRC32(SIGN(0))
4108050209
SELECT CRC32(SQRT(4));
CRC32(SQRT(4))
4117811564
SELECT CRC32(2 > 4);
CRC32(2 > 4)
4108050209
SELECT CRC32(2 < 4);
CRC32(2 < 4)
2212294583
SELECT CRC32(2 >= 4);
CRC32(2 >= 4)
4108050209
SELECT CRC32(2 <= 4);
CRC32(2 <= 4)
2212294583
SELECT CRC32(2 != 4);
CRC32(2 <> 4)
2212294583
SELECT CRC32(NOT 1);
CRC32(NOT 1)
4108050209
SELECT CRC32(1 AND 1);
CRC32(1 AND 1)
2212294583
SELECT CRC32(1 OR 1);
CRC32(1 OR 1)
2212294583
SELECT CRC32(1 XOR 1);
CRC32(1 XOR 1)
4108050209
SELECT CRC32(ASCII('2'));
CRC32(ASCII('2'))
3308380389
SELECT CRC32(BIT_LENGTH('text'));
CRC32(BIT_LENGTH('text'))
2103780943
SELECT CRC32(CHAR('77','121','83','81','76'));
CRC32(CHAR('77','121','83','81','76'))
0
SELECT CRC32(CONCAT('good','year'));
CRC32(CONCAT('good','year'))
3441724142
SELECT CRC32(INSERT('foodyear', 1, 4, 'good'));
CRC32(INSERT('foodyear',1,4,'good'))
3441724142
SELECT CRC32(LEFT('goodyear', 4));
CRC32(LEFT('goodyear',4))
1820610194
SELECT CRC32(LENGTH('text'));
CRC32(LENGTH('text'))
4088798008
SELECT CRC32(LOWER('GOODYEAR'));
CRC32(LOWER('GOODYEAR'))
3441724142
SELECT CRC32(UPPER('goodyear'));
CRC32(UPPER('goodyear'))
186062498
SELECT CRC32(LTRIM('  goodyear'));
CRC32(LTRIM('  goodyear'))
3441724142
SELECT CRC32(RTRIM('goodyear  '));
CRC32(RTRIM('goodyear  '))
3441724142
SELECT CRC32(REPLACE('godyear','o','oo'));
CRC32(REPLACE('godyear','o','oo'))
3441724142
SELECT CRC32(REVERSE('goodyear'));
CRC32(REVERSE('goodyear'))
3423698264
SELECT CRC32(true);
CRC32(TRUE)
2212294583
SELECT CRC32(false);
CRC32(FALSE)
4108050209
DROP TABLE IF EXISTS t1;
CREATE TABLE t1 (c1 BIT(5),
c2 TINYINT,
c3 MEDIUMINT,
c4 INTEGER,
c5 BIGINT,
c6 DECIMAL(7,5),
c7 FLOAT(7,5),
c8 DOUBLE(7,5));
INSERT INTO t1 VALUES (B'10101', 127, 8388607, 2147483647,
9223372036854775807, 10.5, 11.5, 12.5);
SELECT CRC32(c1) FROM t1;
CRC32(c1)
4108050209
SELECT CRC32(c2) FROM t1;
CRC32(c2)
2401609675
SELECT CRC32(c3) FROM t1;
CRC32(c3)
1742563487
SELECT CRC32(c4) FROM t1;
CRC32(c4)
365954768
SELECT CRC32(c5) FROM t1;
CRC32(c5)
1122634462
SELECT CRC32(c6) FROM t1;
CRC32(c6)
4255015174
SELECT CRC32(c7) FROM t1;
CRC32(c7)
298713712
SELECT CRC32(c8) FROM t1;
CRC32(c8)
327728169
DROP TABLE IF EXISTS t1;
CREATE TABLE t1 (c1 DATE,
c2 DATETIME,
c3 TIMESTAMP,
c4 TIME,
c5 YEAR);
INSERT INTO t1 VALUES ('2007-01-01', '2007-01-01 12:00:01',
'2007-01-01 00:00:01.000000',
'12:00:01.000000', '2007');
SELECT CRC32(c1) FROM t1;
CRC32(c1)
2772295888
SELECT CRC32(c2) FROM t1;
CRC32(c2)
1449026401
SELECT CRC32(c3) FROM t1;
CRC32(c3)
404438478
SELECT CRC32(c4) FROM t1;
CRC32(c4)
3872614546
SELECT CRC32(c5) FROM t1;
CRC32(c5)
955685210
DROP TABLE IF EXISTS t1;
CREATE TABLE t1 (c1 CHAR,
c2 VARCHAR(10),
c3 BINARY(1),
c4 VARBINARY(10),
c5 TINYBLOB,
c6 TINYTEXT,
c7 BLOB,
c8 TEXT,
c9 MEDIUMBLOB,
c10 MEDIUMTEXT,
c11 LONGBLOB,
c12 LONGTEXT);
INSERT INTO t1 VALUES ('a', 'a', 0x61, 0x61, 'a', 'a',
'a', 'a', 'a', 'a', 'a', 'a');
SELECT CRC32(c1) FROM t1;
CRC32(c1)
3904355907
SELECT CRC32(c2) FROM t1;
CRC32(c2)
3904355907
SELECT CRC32(c3) FROM t1;
CRC32(c3)
1397722906
SELECT CRC32(c4) FROM t1;
CRC32(c4)
1397722906
SELECT CRC32(c5) FROM t1;
CRC32(c5)
3904355907
SELECT CRC32(c6) FROM t1;
CRC32(c6)
3904355907
SELECT CRC32(c7) FROM t1;
CRC32(c7)
3904355907
SELECT CRC32(c8) FROM t1;
CRC32(c8)
3904355907
SELECT CRC32(c9) FROM t1;
CRC32(c9)
3904355907
SELECT CRC32(c10) FROM t1;
CRC32(c10)
3904355907
SELECT CRC32(c11) FROM t1;
CRC32(c11)
3904355907
SELECT CRC32(c12) FROM t1;
CRC32(c12)
3904355907
SELECT CRC32(ST_GeomFromText('POINT(1 1)'));
CRC32(ST_GEOMFROMTEXT('POINT(1 1)'))
3651209608
CREATE TABLE geom_data(id INT,
pt POINT NOT NULL,
lnstr LINESTRING NOT NULL,
mlnstr MULTILINESTRING NOT NULL,
poly POLYGON NOT NULL,
mpoly MULTIPOLYGON NOT NULL);
INSERT INTO geom_data VALUES (10,
ST_GEOMFROMTEXT('POINT(10 20)'),
ST_GEOMFROMTEXT('LINESTRING(0 0,5 5,6 6)'),
ST_GEOMFROMTEXT('MULTILINESTRING((0 0,2 3,4 5),(6 6,8 8,9 9,10 10))'),
ST_GEOMFROMTEXT('POLYGON((0 0,6 7,8 8,3 9,0 0),(3 6,4 6,4 7,3 6))'),
ST_GEOMFROMTEXT('MULTIPOLYGON(((0 0,0 5,5 5,5 0,0 0)),
                                ((2 2,4 5,6 2,2 2)))'));
SELECT CRC32(ST_X(pt)) FROM geom_data;
CRC32(ST_X(pt))
1617337544
SELECT CRC32(ST_NumPoints((lnstr))) FROM geom_data;
CRC32(ST_NUMPOINTS(lnstr))
1842515611
SELECT CRC32(ST_Length((mlnstr))) FROM geom_data;
CRC32(ST_LENGTH(mlnstr))
2090153432
SELECT CRC32(ST_Area((poly))) FROM geom_data;
CRC32(ST_AREA(poly))
534598600
SELECT CRC32(ST_Area((mpoly))) FROM geom_data;
CRC32(ST_AREA(mpoly))
3417128564
DROP TABLE geom_data;
DROP TABLE IF EXISTS t1;
CREATE TABLE t1 (e1 ENUM ('a','b'), s1 SET('a','b'));
INSERT INTO t1 VALUES(2,'a,b'),('a','b,a');
SELECT e1, CRC32(e1) FROM t1;
e1	CRC32(e1)
2	450215437
a	3904355907
SELECT s1, CRC32(s1) FROM t1;
s1	CRC32(s1)
a,b	752423903
b,a	3080125500
DROP TABLE IF EXISTS t1;
CREATE TABLE t1 (a INT);
INSERT INTO t1 VALUES(10);
CREATE VIEW v1 AS SELECT CRC32(a) AS my_crc FROM t1;
SELECT * FROM v1;
my_crc
2707236321
SELECT CRC32(CRC32(my_crc)) FROM v1;
CRC32(CRC32(my_crc))
3114155452
DROP VIEW v1;
DROP TABLE t1;
CREATE TABLE t1 (a CHAR);
CREATE TABLE t2 (b BIGINT);
CREATE TRIGGER trg1
BEFORE INSERT ON t1
FOR EACH ROW
INSERT INTO t2 VALUES(CRC32(NEW.a));
INSERT INTO t1 VALUES('a');
SELECT * FROM t2;
b
3904355907
DROP TRIGGER trg1;
DROP TABLE t2;
DROP TABLE t1;
PREPARE stmt1 FROM 'SELECT CRC32(?)';
SET @val = 'a';
EXECUTE stmt1 USING @val;
CRC32('a')
3904355907
DEALLOCATE PREPARE stmt;
#
# Bug#27134168 UBSAN: MY_DOUBLE_ROUND - NEGATION OF BLAH
#
SELECT truncate(
0x123,
-9223372036854775808
);
TRUNCATE(blob,-9223372036854775808)
0
#
# Bug#28401869 ARM BUILD ALLOWS NUMERIC VALUES OUT OF BOUNDS
#
select cast(pow(2,63) as signed) as pp;
ERROR 22003: BIGINT value is out of range, casting 9223372036854776000 to SIGNED
select cast(pow(2,63)-1024 as signed) as pp;
pp
9223372036854774784
select cast(1-pow(2,63) as signed) as qq;
qq
-9223372036854775808
#
# Bug#17081376 ITEM_FUNC_MUL::INT_OP() MISHANDLES 9223372036854775809*-1
#
SELECT 9223372036854775809 * -1;
ERROR 22003: BIGINT UNSIGNED value is out of range
SELECT -1 * 9223372036854775809;
ERROR 22003: BIGINT UNSIGNED value is out of range
#
# Bug#28505423 UBSAN: SIGNED INTEGER OVERFLOW IN MY_STRNTOULL10RND_8BIT
#
CREATE TABLE t(a int);
INSERT INTO t VALUES(hex(rtrim(1.040739e+308)));
ERROR 22003: Out of range value for column, value '3130343037333930303030303030303030303030303030303030303030303030'
DROP TABLE t;
#
# Bug#28706832 WINDOWS ALLOWS NUMERIC VALUES OUT OF BOUNDS
#
SELECT 1-CAST(POW(2,100) AS SIGNED);
ERROR 22003: BIGINT value is out of range, casting 1267650600228229400000000000000 to SIGNED
SELECT 1-CAST(POW(2,1000) AS SIGNED);
ERROR 22003: BIGINT value is out of range, casting 10715086071862673000000000000000000000000000000000000000000000000000000000000000000000000000000000000000000000000000000000000000000000000000000000000000000000000000000000000000000000000000000000000000000000000000000000000000000000000000000000000000000000000000000000000000000000000000000000000000000000 to SIGNED
#
# Bug#29581610 UBSAN ERROR IN ITEM_FUNC_MUL::INT_OP()
#
do ((3273059463432352943 )* (-9223372036854775808 )) ;
ERROR HY000: BIGINT value is out of range
do ((-9223372036854775808)* ( 3273059463432352943)) ;
ERROR HY000: BIGINT value is out of range
select -9223372036854775808 * 0 as result;
result
0
select 0 * -9223372036854775808 as result;
result
0
select -9223372036854775808 * 1 as result;
result
-9223372036854775808
select 1 * -9223372036854775808 as result;
result
-9223372036854775808
select -9223372036854775808 * -1 as result;
ERROR 22003: BIGINT value is out of range
select -1 * -9223372036854775808 as result;
ERROR 22003: BIGINT value is out of range
select -9223372036854775808 * 2 as result;
ERROR 22003: BIGINT value is out of range
select 2 * -9223372036854775808 as result;
ERROR 22003: BIGINT value is out of range
#
# Bug#30139913 CEILING AND FLOOR HAVE INCORRECT RESOLVED TYPES FOR BIGINT
#              ARGUMENTS
#
CREATE TABLE t1(a BIGINT UNSIGNED);
SHOW CREATE TABLE t1;
Table	Create Table
t1	CREATE TABLE `t1` (
  `a` BIGINT UNSIGNED
) ENGINE=RooDB DEFAULT CHARSET=utf8mb4
INSERT INTO t1 VALUES(18446744073709551615);
CREATE TABLE t2 AS
SELECT CEILING(a) AS c, FLOOR(a) AS f FROM t1;
DESCRIBE t2;
Field	Type	Null	Key	Default	Extra
c	BIGINT UNSIGNED	YES		NULL	
f	BIGINT UNSIGNED	YES		NULL	
SELECT * FROM t2;
c	f
18446744073709551615	18446744073709551615
DROP TABLE t1, t2;
# BIGINT should resolve to BIGINT.
CREATE TABLE t AS
SELECT CEILING(18446744073709551615) AS c,
FLOOR(18446744073709551615) AS f;
DESCRIBE t;
Field	Type	Null	Key	Default	Extra
c	BIGINT UNSIGNED	NO		NULL	
f	BIGINT UNSIGNED	NO		NULL	
DROP TABLE t;
# DECIMAL should resolve to DECIMAL when too big for BIGINT.
CREATE TABLE t AS
SELECT CEILING(18446744073709551616) AS c,
FLOOR(18446744073709551616) AS f;
DESCRIBE t;
Field	Type	Null	Key	Default	Extra
c	DECIMAL(20,0)	NO		NULL	
f	DECIMAL(20,0)	NO		NULL	
DROP TABLE t;
# CEILING/FLOOR has to always assume a signed DECIMAL, making this too
# big for BIGINT.
CREATE TABLE t AS
SELECT CEILING(CAST(1844674407370955161 AS DECIMAL(19, 0))) AS c,
FLOOR(CAST(1844674407370955161 AS DECIMAL(19, 0))) AS f;
DESCRIBE t;
Field	Type	Null	Key	Default	Extra
c	DECIMAL(19,0)	NO		NULL	
f	DECIMAL(19,0)	NO		NULL	
SELECT * FROM t;
c	f
1844674407370955161	1844674407370955161
DROP TABLE t;
CREATE TABLE t AS
SELECT CEILING(CAST(-9223372036854775808 AS DECIMAL(19, 0))) AS c,
FLOOR(CAST(-9223372036854775808 AS DECIMAL(19, 0))) AS f;
DESCRIBE t;
Field	Type	Null	Key	Default	Extra
c	DECIMAL(19,0)	NO		NULL	
f	DECIMAL(19,0)	NO		NULL	
SELECT * FROM t;
c	f
-9223372036854775808	-9223372036854775808
DROP TABLE t;
# DECIMAL should resolve to BIGINT when it fits.
CREATE TABLE t AS
SELECT CEILING(CAST(184467440737095516 AS DECIMAL(18, 0))) AS c,
FLOOR(CAST(184467440737095516 AS DECIMAL(18, 0))) AS f;
DESCRIBE t;
Field	Type	Null	Key	Default	Extra
c	DECIMAL(18,0)	NO		NULL	
f	DECIMAL(18,0)	NO		NULL	
SELECT * FROM t;
c	f
184467440737095516	184467440737095516
DROP TABLE t;
CREATE TABLE t AS
SELECT CEILING(CAST(-922337203685477580 AS DECIMAL(18, 0))) AS c,
FLOOR(CAST(-922337203685477580 AS DECIMAL(18, 0))) AS f;
DESCRIBE t;
Field	Type	Null	Key	Default	Extra
c	DECIMAL(18,0)	NO		NULL	
f	DECIMAL(18,0)	NO		NULL	
SELECT * FROM t;
c	f
-922337203685477580	-922337203685477580
DROP TABLE t;
# Account for possible increase of order of magnitude when rounding.
CREATE TABLE t AS
SELECT CEILING(CAST(99999999999999999.9 AS DECIMAL(18, 1))) AS c,
FLOOR(CAST(-99999999999999999.9 AS DECIMAL(18, 1))) AS f;
DESCRIBE t;
Field	Type	Null	Key	Default	Extra
c	DECIMAL(18,1)	NO		NULL	
f	DECIMAL(18,1)	NO		NULL	
SELECT * FROM t;
c	f
100000000000000000	-100000000000000000
DROP TABLE t;
CREATE TABLE t AS
SELECT CEILING(CAST(999999999999999999.9 AS DECIMAL(19, 1))) AS c,
FLOOR(CAST(-999999999999999999.9 AS DECIMAL(19, 1))) AS f;
DESCRIBE t;
Field	Type	Null	Key	Default	Extra
c	DECIMAL(19,1)	NO		NULL	
f	DECIMAL(19,1)	NO		NULL	
SELECT * FROM t;
c	f
1000000000000000000	-1000000000000000000
DROP TABLE t;
#
# Bug #29952066 CAST OF NEGATIVE FUNCTION RETURN VALUE TO
#               UNSIGNED MALFUNCTIONS WITH BIGINT
#
CREATE TABLE t0(c0 BIGINT UNSIGNED);
INSERT INTO t0(c0) VALUES(NULL);
SELECT * FROM t0 WHERE CAST(COALESCE(t0.c0, -1) AS UNSIGNED);
c0
NULL
SELECT * FROM t0 WHERE CAST(IFNULL(t0.c0, -1) AS UNSIGNED);
c0
NULL
SELECT CAST(COALESCE(t0.c0, -1) AS UNSIGNED) IS TRUE FROM t0;
CAST(COALESCE(c0,-1) AS unsigned) IS IsTrue
1
SELECT CAST(COALESCE(t0.c0, -1) AS UNSIGNED) FROM t0;
CAST(COALESCE(c0,-1) AS unsigned)
18446744073709551615
DROP TABLE t0;
SELECT CAST(-1.1 AS UNSIGNED);
CAST(-1.1 AS unsigned)
0
#
#
# Bug #30680384 UBSAN: RUNTIME ERROR: NEGATION
#               OF -9223372036854775808 IN ITEM_FUNC_ROUND::INT_OP()
#
select (round(-9223372036854775808, -4));
ERROR 22003: BIGINT value is out of range
# Bug#31128028 ROUND and TRUNCATE sometimes produce wrong result types
CREATE TABLE t1(a INTEGER, b INTEGER);
INSERT INTO t1 VALUES(11, -1);
CREATE TABLE t2 AS SELECT a, ROUND(a, b) AS c FROM t1;
DESCRIBE t2;
Field	Type	Null	Key	Default	Extra
a	INT	YES		NULL	
c	INT	YES		NULL	
DROP TABLE t1, t2;
SET sql_mode = DEFAULT;
#
# Bug #30156563 TYPE RESOLUTION OF DIV OPERATOR
#               PRODUCES ONE LESS PRECISION.
#
SELECT 5.0 + 96 DIV 1;
5 + 96 DIV 1
101
CREATE TABLE t1 SELECT
5.0 + 96 DIV 1,                     # Dividend is integer
5.0 + 96.1234 DIV 1,                # Dividend is decimal
5.0 + '96' DIV 1,                   # Dividend is string
5.0 + CAST('96' AS SIGNED) DIV 1,   # Dividend is function
5.0 + CAST('96' AS UNSIGNED) DIV 1;
SHOW CREATE TABLE t1;
Table	Create Table
t1	CREATE TABLE `t1` (
  `5 + 96 DIV 1` DOUBLE NOT NULL,
  `5 + 96.1234 DIV 1` DOUBLE NOT NULL,
  `5 + '96' DIV 1` DOUBLE NOT NULL,
  `5 + CAST('96' AS BIGINT) DIV 1` DOUBLE NOT NULL,
  `5 + CAST('96' AS unsigned) DIV 1` DOUBLE NOT NULL
) ENGINE=RooDB DEFAULT CHARSET=utf8mb4
DROP TABLE t1;
#
# Bug #32693863 MINUS BETWEEN CONST VALUE 0 AND FIELD WITH
#               MIN BIGINT VALUE GETS WRONG RESULT
#
CREATE TABLE t1(a BIGINT);
INSERT INTO t1 VALUES (-9223372036854775808);
SELECT a, 0-a FROM t1;
ERROR 22003: BIGINT value is out of range
DELETE FROM t1;
INSERT INTO t1 VALUES (-9223372036854775807);
SELECT a, 1-a FROM t1;
ERROR 22003: BIGINT value is out of range
DROP TABLE t1;
# Bug#32863037: Assertion `scale >= 0 && precision > 0 &&
#               scale <= precision' failed
SELECT * FROM (SELECT -TRUE AS a, --TRUE AS b) AS dt;
a	b
-1	1
# Bug#33142010: Failure on complex const argument to string functions
CREATE VIEW v AS SELECT -(1 NOT IN (0)) AS c;
SHOW CREATE TABLE v;
View	Create View
v	CREATE ALGORITHM=UNDEFINED VIEW `v` AS SELECT -(1 NOT IN (0)) AS c
SELECT * FROM v;
c
-1
DROP VIEW v;
