SELECT FORMAT(1.5555,0), FORMAT(123.5555,1), FORMAT(1234.5555,2), FORMAT(12345.55555,3), FORMAT(123456.5555,4), FORMAT(1234567.5555,5), FORMAT('12345.2399',2);
FORMAT(1.5555,0)	FORMAT(123.5555,1)	FORMAT(1234.5555,2)	FORMAT(12345.55555,3)	FORMAT(123456.5555,4)	FORMAT(1234567.5555,5)	FORMAT('12345.2399',2)
2	123.6	1,234.56	12,345.556	123,456.5555	1,234,567.55550	0.00
SELECT INET_NTOA(INET_ATON('255.255.255.255'));
INET_NTOA(INET_ATON('255.255.255.255'))
255.255.255.255
SELECT INET_ATON('255.255.1.255'), INET_ATON('0.1.255');
INET_ATON('255.255.1.255')	INET_ATON('0.1.255')
4294902271	NULL
SELECT INET_NTOA(4294902271), INET_NTOA(511);
INET_NTOA(4294902271)	INET_NTOA(511)
255.255.1.255	0.0.1.255
SELECT HEX(INET_ATON('127'));
HEX(INET_ATON('127'))
NULL
SELECT HEX(INET_ATON('127.1'));
HEX(INET_ATON('127.1'))
NULL
SELECT HEX(INET_ATON('127.1.1'));
HEX(INET_ATON('127.1.1'))
NULL
SELECT INET_ATON('122.256');
INET_ATON('122.256')
NULL
SELECT INET_ATON('122.226.');
INET_ATON('122.226.')
NULL
SELECT INET_ATON('');
INET_ATON('')
NULL
SELECT LENGTH(FORMAT('nan', 2)) > 0;
LENGTH(FORMAT('nan',2)) > 0
1
SELECT CONCAT('$', FORMAT(2500,2));
CONCAT('$',FORMAT(2500,2))
$2,500.00
SELECT INET_NTOA(0);
INET_NTOA(0)
0.0.0.0
SELECT '1' IN ('1', INET_NTOA(0));
'1' IN ('1', INET_NTOA(0))
1
CREATE TABLE t1 (a INT, b INT);
INSERT INTO t1 VALUES (0, 0);
SELECT COALESCE(a) = COALESCE(b) FROM t1;
COALESCE(a) = COALESCE(b)
1
DROP TABLE t1;
CREATE TABLE t1 (a INT);
INSERT INTO t1 VALUES (1), (2), (3);
SELECT LEAST(a, 2) FROM t1;
LEAST(a,2)
1
2
2
SELECT GREATEST(a, 2) FROM t1;
GREATEST(a,2)
2
2
3
DROP TABLE t1;
SELECT CONNECTION_ID() > 0;
CONNECTION_ID() > 0
1
SELECT INET6_ATON(NULL) IS NULL;
INET6_ATON(NULL) IS NULL
1
SELECT INET6_ATON('1.2.3') IS NULL;
INET6_ATON('1.2.3') IS NULL
1
SELECT INET6_ATON('1.2.3.') IS NULL;
INET6_ATON('1.2.3.') IS NULL
1
SELECT INET6_ATON('1..3.4') IS NULL;
INET6_ATON('1..3.4') IS NULL
1
SELECT INET6_ATON('-1.2.3.4') IS NULL;
INET6_ATON('-1.2.3.4') IS NULL
1
SELECT INET6_ATON('1.2.3.256') IS NULL;
INET6_ATON('1.2.3.256') IS NULL
1
SELECT INET6_ATON('1.2.3.4.5') IS NULL;
INET6_ATON('1.2.3.4.5') IS NULL
1
SELECT HEX(INET6_ATON('0.0.0.0'));
HEX(INET6_ATON('0.0.0.0'))
00000000
SELECT HEX(INET6_ATON('1.2.3.4'));
HEX(INET6_ATON('1.2.3.4'))
01020304
SELECT HEX(INET6_ATON('255.255.255.255'));
HEX(INET6_ATON('255.255.255.255'))
FFFFFFFF
SELECT HEX(INET6_ATON('::'));
HEX(INET6_ATON('::'))
00000000000000000000000000000000
SELECT HEX(INET6_ATON('1::2'));
HEX(INET6_ATON('1::2'))
00010000000000000000000000000002
SELECT HEX(INET6_ATON('::1'));
HEX(INET6_ATON('::1'))
00000000000000000000000000000001
SELECT HEX(INET6_ATON('1:2:3:4:5:6:7:8'));
HEX(INET6_ATON('1:2:3:4:5:6:7:8'))
00010002000300040005000600070008
SELECT INET6_NTOA(INET6_ATON('::'));
INET6_NTOA(INET6_ATON('::'))
::
SELECT INET6_NTOA(INET6_ATON('1::2'));
INET6_NTOA(INET6_ATON('1::2'))
1::2
SELECT INET6_NTOA(INET6_ATON('::1'));
INET6_NTOA(INET6_ATON('::1'))
::1
SELECT INET6_NTOA(INET6_ATON('1:2:3:4:5:6:7:8'));
INET6_NTOA(INET6_ATON('1:2:3:4:5:6:7:8'))
1:2:3:4:5:6:7:8
SELECT HEX(INET_ATON('192.168.1.2'));
HEX(INET_ATON('192.168.1.2'))
C0A80102
SELECT HEX(INET6_ATON('192.168.1.2'));
HEX(INET6_ATON('192.168.1.2'))
C0A80102
SELECT HEX(INET_ATON('255.255.255.255'));
HEX(INET_ATON('255.255.255.255'))
FFFFFFFF
SELECT HEX(INET6_ATON('255.255.255.255'));
HEX(INET6_ATON('255.255.255.255'))
FFFFFFFF
CREATE TABLE t1 (ip INT UNSIGNED);
CREATE TABLE t2 (ip VARBINARY(16));
INSERT INTO t1 VALUES (INET_ATON('1.2.3.4')), (INET_ATON('255.255.255.255'));
SELECT INET_NTOA(ip) FROM t1;
INET_NTOA(ip)
1.2.3.4
255.255.255.255
INSERT INTO t2 SELECT INET6_ATON(INET_NTOA(ip)) FROM t1;
SELECT INET6_NTOA(ip), HEX(ip), LENGTH(ip) FROM t2;
INET6_NTOA(ip)	HEX(ip)	LENGTH(ip)
1.2.3.4	01020304	4
255.255.255.255	FFFFFFFF	4
DELETE FROM t2;
INSERT INTO t2 VALUES
(INET6_ATON('1.2.3.4')), (INET6_ATON('255.255.255.255')),
(INET6_ATON('::1.2.3.4')), (INET6_ATON('::ffff:255.255.255.255')),
(INET6_ATON('::')), (INET6_ATON('::1')),
(INET6_ATON('1020:3040:5060:7080:90A0:B0C0:D0E0:F010'));
SELECT INET6_NTOA(ip), HEX(ip), LENGTH(ip) FROM t2;
INET6_NTOA(ip)	HEX(ip)	LENGTH(ip)
1.2.3.4	01020304	4
255.255.255.255	FFFFFFFF	4
::102:304	00000000000000000000000001020304	16
::ffff:255.255.255.255	00000000000000000000FFFFFFFFFFFF	16
::	00000000000000000000000000000000	16
::1	00000000000000000000000000000001	16
1020:3040:5060:7080:90a0:b0c0:d0e0:f010	102030405060708090A0B0C0D0E0F010	16
DROP TABLE t1;
DROP TABLE t2;
SELECT INET_ATON('0.255.255.255.255');
INET_ATON('0.255.255.255.255')
NULL
SELECT INET_ATON('255.255.255.2551');
INET_ATON('255.255.255.2551')
NULL
SELECT SLEEP(0);
SLEEP(0)
0
SELECT HEX(INET6_ATON(INET_NTOA(INET_ATON('1.2.3.4'))));
HEX(INET6_ATON(INET_NTOA(INET_ATON('1.2.3.4'))))
01020304
