CREATE TABLE t1 (a INT, b INT, c INT);
INSERT INTO t1 VALUES (1,2,10), (3,4,20);
SELECT * FROM t1;
a	b	c
1	2	10
3	4	20
INSERT INTO t1 VALUES (5,6,30);
SELECT * FROM t1;
a	b	c
1	2	10
3	4	20
5	6	30
TRUNCATE TABLE t1;
INSERT INTO t1 VALUES (1,2,10), (3,4,20);
SELECT * FROM t1;
a	b	c
1	2	10
3	4	20
DROP TABLE t1;
CREATE TABLE t1 (a INT PRIMARY KEY, b INT);
INSERT INTO t1 VALUES(1,1),(2,2),(3,3),(4,4),(5,5);
SELECT * FROM t1;
a	b
1	1
2	2
3	3
4	4
5	5
INSERT INTO t1 VALUES(1,99);
ERROR 23000: Raft error: Raft error: Duplicate key: row in 't1' already exists
SELECT * FROM t1;
a	b
1	1
2	2
3	3
4	4
5	5
DROP TABLE t1;
CREATE TABLE t1 (a INT, b INT, c INT);
INSERT INTO t1 VALUES (1,2,10), (3,4,20);
CREATE TABLE t2 (a INT, b INT, c INT, d INT);
INSERT INTO t2 VALUES (5,6,30,1), (7,8,40,1), (9,10,60,1);
INSERT INTO t1 SELECT a,b,c FROM t2 WHERE d=1;
SELECT * FROM t1;
a	b	c
1	2	10
3	4	20
5	6	30
7	8	40
9	10	60
DROP TABLE t1;
DROP TABLE t2;
CREATE TABLE t1 (
a BIGINT UNSIGNED,
b BIGINT UNSIGNED,
PRIMARY KEY (a)
);
INSERT INTO t1 VALUES (45, 1);
SELECT * FROM t1;
a	b
45	1
INSERT INTO t1 VALUES (46, 2);
SELECT * FROM t1;
a	b
45	1
46	2
DROP TABLE t1;
CREATE TABLE t1 (i INT PRIMARY KEY, j INT);
INSERT INTO t1 VALUES (1, 10);
INSERT INTO t1 VALUES (2, 20);
SELECT * FROM t1;
i	j
1	10
2	20
DROP TABLE t1;
CREATE TABLE t1 (i INT PRIMARY KEY, j INT);
CREATE TABLE t2 (a INT);
INSERT INTO t1 VALUES (1, 1);
INSERT INTO t2 VALUES (10), (20);
SELECT * FROM t1;
i	j
1	1
SELECT * FROM t2;
a
10
20
DROP TABLE t1, t2;
CREATE TABLE t0 (k INTEGER PRIMARY KEY);
CREATE TABLE t1 (a INTEGER);
CREATE TABLE t2 (a INTEGER);
INSERT INTO t1 VALUES (1), (2);
INSERT INTO t2 VALUES (1), (3);
INSERT INTO t0 SELECT a FROM t1 UNION SELECT a FROM t2;
SELECT * FROM t0;
k
1
2
3
DROP TABLE t0, t1, t2;
CREATE TABLE t1 (a INTEGER NOT NULL);
INSERT INTO t1 VALUES(0);
CREATE TABLE t2 (d INTEGER);
SELECT * FROM t1;
a
0
SELECT * FROM t2;
d
DROP TABLE t1, t2;
CREATE TABLE t1 (a INTEGER, b INTEGER, PRIMARY KEY(a,b));
INSERT INTO t1 VALUES (1, 1);
INSERT INTO t1 VALUES (1, 2);
INSERT INTO t1 VALUES (2, 1);
SELECT * FROM t1;
a	b
1	1
1	2
2	1
INSERT INTO t1 VALUES (1, 1);
ERROR 23000: Raft error: Raft error: Duplicate key: row in 't1' already exists
SELECT * FROM t1;
a	b
1	1
1	2
2	1
DROP TABLE t1;
CREATE TABLE t1 (pk VARCHAR(10) PRIMARY KEY, col VARCHAR(10));
INSERT INTO t1 VALUES ('1', 'Carmen'), ('2', 'Martin');
SELECT * FROM t1;
pk	col
1	Carmen
2	Martin
DROP TABLE t1;
CREATE TABLE t1 (a INT PRIMARY KEY, b INT);
INSERT INTO t1 VALUES (1, 2);
INSERT INTO t1 VALUES (2, 3);
SELECT * FROM t1;
a	b
1	2
2	3
UPDATE t1 SET b = b + 10 WHERE a = 1;
SELECT * FROM t1;
a	b
1	12
2	3
DROP TABLE t1;
CREATE TABLE t1 (id INT NOT NULL PRIMARY KEY, text1 TEXT, text2 TEXT);
INSERT INTO t1 VALUES (0, 'x', 'x'), (1, 'y', 'y');
SELECT * FROM t1;
id	text1	text2
0	x	x
1	y	y
UPDATE t1 SET text1 = 'z', text2 = 'w' WHERE id = 0;
SELECT * FROM t1;
id	text1	text2
0	z	w
1	y	y
DROP TABLE t1;
CREATE TABLE t1 (
id INT AUTO_INCREMENT PRIMARY KEY,
c1 CHAR(1),
cnt INT DEFAULT 1
);
INSERT INTO t1 (c1) VALUES ('A'), ('B'), ('C');
SELECT c1, cnt FROM t1 ORDER BY c1;
c1	cnt
A	1
B	1
C	1
DROP TABLE t1;
CREATE TABLE t1 (a INT PRIMARY KEY, b INT, c VARCHAR(20));
INSERT INTO t1 SET a=1, b=10, c='first';
INSERT INTO t1 SET a=2, b=20, c='second';
INSERT INTO t1 SET a=3;
SELECT * FROM t1;
a	b	c
1	10	first
2	20	second
3	NULL	NULL
DROP TABLE t1;
CREATE TABLE t1 (a INT PRIMARY KEY, b INT DEFAULT 0);
INSERT INTO t1 (a) VALUES (1);
INSERT INTO t1 (a, b) VALUES (2, 10);
INSERT INTO t1 VALUES (3, 20);
SELECT * FROM t1;
a	b
1	0
2	10
3	20
DROP TABLE t1;
CREATE TABLE t1 (a INT PRIMARY KEY, b INT);
INSERT INTO t1 VALUES (1, 10 + 5);
INSERT INTO t1 VALUES (2, 100 * 2);
INSERT INTO t1 VALUES (3, 7 - 3);
SELECT * FROM t1;
a	b
1	15
2	200
3	4
DROP TABLE t1;
