CREATE TABLE t1(a INTEGER);
INSERT INTO t1 VALUES(11),(12),(13),(14),(15),(16),(17),(18),(19);
CREATE TABLE t2(a INTEGER);
INSERT INTO t2 VALUES(21),(22),(23),(24),(25),(26),(27);
SELECT * FROM t1 LIMIT 6;
a
11
12
13
14
15
16
SELECT * FROM t1 LIMIT 5 OFFSET 1;
a
12
13
14
15
16
(SELECT * FROM t1 LIMIT 7) ORDER BY a DESC LIMIT 4;
a
19
18
17
16
(SELECT * FROM t1 LIMIT 7 OFFSET 1) ORDER BY a DESC LIMIT 4 OFFSET 2;
a
17
16
15
14
(SELECT * FROM t1 ORDER BY a DESC LIMIT 7) ORDER BY a LIMIT 4;
a
19
18
17
16
(SELECT * FROM t1 ORDER BY a DESC LIMIT 7 OFFSET 1) ORDER BY a LIMIT 4 OFFSET 2;
a
17
16
15
14
SELECT * FROM t1 UNION SELECT * FROM t2 LIMIT 5;
a
11
12
13
14
15
SELECT * FROM t1 UNION SELECT * FROM t2 LIMIT 5 OFFSET 6;
a
11
12
13
14
15
SELECT * FROM t1 UNION SELECT * FROM t2 ORDER BY a LIMIT 5;
a
11
12
13
14
15
SELECT * FROM t1 UNION SELECT * FROM t2 ORDER BY a LIMIT 5 OFFSET 6;
a
11
12
13
14
15
SELECT * FROM t1 UNION ALL SELECT * FROM t2 LIMIT 5;
a
11
12
13
14
15
SELECT * FROM t1 UNION ALL SELECT * FROM t2 LIMIT 5 OFFSET 6;
a
11
12
13
14
15
SELECT * FROM t1 UNION ALL SELECT * FROM t2 ORDER BY a LIMIT 5;
a
11
12
13
14
15
SELECT * FROM t1 UNION ALL SELECT * FROM t2 ORDER BY a LIMIT 5 OFFSET 6;
a
11
12
13
14
15
(SELECT * FROM t1 LIMIT 5) UNION
SELECT * FROM t2
LIMIT 8;
(SELECT * FROM t1 LIMIT 5 OFFSET 4) UNION
SELECT * FROM t2
LIMIT 8 OFFSET 1;
(SELECT * FROM t1 ORDER BY a DESC LIMIT 5) UNION
SELECT * FROM t2
LIMIT 8;
(SELECT * FROM t1 ORDER BY a DESC LIMIT 5 OFFSET 4) UNION
SELECT * FROM t2
LIMIT 8 OFFSET 1;
(SELECT * FROM t1 LIMIT 5) UNION
SELECT * FROM t2
ORDER BY a LIMIT 8;
(SELECT * FROM t1 LIMIT 5 OFFSET 4) UNION
SELECT * FROM t2
ORDER BY a LIMIT 8 OFFSET 1;
(SELECT * FROM t1 ORDER BY a DESC LIMIT 5) UNION
SELECT * FROM t2
ORDER BY a LIMIT 8;
(SELECT * FROM t1 ORDER BY a DESC LIMIT 5 OFFSET 4) UNION
SELECT * FROM t2
ORDER BY a LIMIT 8 OFFSET 1;
(SELECT * FROM t1 LIMIT 5) UNION ALL
SELECT * FROM t2
LIMIT 8;
a
11
12
13
14
15
21
22
23
(SELECT * FROM t1 LIMIT 5 OFFSET 4) UNION ALL
SELECT * FROM t2
LIMIT 8 OFFSET 1;
a
15
16
17
18
19
22
23
24
(SELECT * FROM t1 ORDER BY a DESC LIMIT 5) UNION ALL
SELECT * FROM t2
LIMIT 8;
a
19
18
17
16
15
21
22
23
(SELECT * FROM t1 ORDER BY a DESC LIMIT 5 OFFSET 4) UNION ALL
SELECT * FROM t2
LIMIT 8 OFFSET 1;
a
15
14
13
12
11
22
23
24
(SELECT * FROM t1 LIMIT 5) UNION ALL
SELECT * FROM t2
ORDER BY a LIMIT 8;
a
11
12
13
14
15
21
22
23
(SELECT * FROM t1 LIMIT 5 OFFSET 4) UNION ALL
SELECT * FROM t2
ORDER BY a LIMIT 8 OFFSET 1;
a
15
16
17
18
19
22
23
24
(SELECT * FROM t1 ORDER BY a DESC LIMIT 5) UNION ALL
SELECT * FROM t2
ORDER BY a LIMIT 8;
a
15
16
17
18
19
21
22
23
(SELECT * FROM t1 ORDER BY a DESC LIMIT 5 OFFSET 4) UNION ALL
SELECT * FROM t2
ORDER BY a LIMIT 8 OFFSET 1;
a
11
12
13
14
15
22
23
24
(SELECT * FROM t1 LIMIT 5) UNION
(SELECT * FROM t2 LIMIT 4)
LIMIT 7;
(SELECT * FROM t1 LIMIT 5 OFFSET 4) UNION
(SELECT * FROM t2 LIMIT 4 OFFSET 2)
LIMIT 7 OFFSET 1;
(SELECT * FROM t1 ORDER BY a DESC LIMIT 5) UNION
(SELECT * FROM t2 ORDER BY a DESC LIMIT 4)
LIMIT 7;
(SELECT * FROM t1 ORDER BY a DESC LIMIT 5 OFFSET 4) UNION
(SELECT * FROM t2 ORDER BY a DESC LIMIT 4 OFFSET 2)
LIMIT 7 OFFSET 1;
(SELECT * FROM t1 LIMIT 5) UNION
(SELECT * FROM t2 LIMIT 4)
ORDER BY a LIMIT 7;
(SELECT * FROM t1 LIMIT 5 OFFSET 4) UNION
(SELECT * FROM t2 LIMIT 4 OFFSET 2)
ORDER BY a LIMIT 7 OFFSET 1;
(SELECT * FROM t1 ORDER BY a DESC LIMIT 5) UNION
(SELECT * FROM t2 ORDER BY a DESC LIMIT 4)
ORDER BY a LIMIT 7;
(SELECT * FROM t1 ORDER BY a DESC LIMIT 5 OFFSET 4) UNION
(SELECT * FROM t2 ORDER BY a DESC LIMIT 4 OFFSET 2)
ORDER BY a LIMIT 7 OFFSET 1;
(SELECT * FROM t1 LIMIT 5) UNION ALL
(SELECT * FROM t2 LIMIT 4)
LIMIT 7;
a
11
12
13
14
15
21
22
(SELECT * FROM t1 LIMIT 5 OFFSET 4) UNION ALL
(SELECT * FROM t2 LIMIT 4 OFFSET 2)
LIMIT 7 OFFSET 1;
a
15
16
17
18
19
22
23
(SELECT * FROM t1 ORDER BY a DESC LIMIT 5) UNION ALL
(SELECT * FROM t2 ORDER BY a DESC LIMIT 4)
LIMIT 7;
a
19
18
17
16
15
27
26
(SELECT * FROM t1 ORDER BY a DESC LIMIT 5 OFFSET 4) UNION ALL
(SELECT * FROM t2 ORDER BY a DESC LIMIT 4 OFFSET 2)
LIMIT 7 OFFSET 1;
a
15
14
13
12
11
26
25
(SELECT * FROM t1 LIMIT 5) UNION ALL
(SELECT * FROM t2 LIMIT 4)
ORDER BY a LIMIT 7;
a
11
12
13
14
15
21
22
(SELECT * FROM t1 LIMIT 5 OFFSET 4) UNION ALL
(SELECT * FROM t2 LIMIT 4 OFFSET 2)
ORDER BY a LIMIT 7 OFFSET 1;
a
15
16
17
18
19
22
23
(SELECT * FROM t1 ORDER BY a DESC LIMIT 5) UNION ALL
(SELECT * FROM t2 ORDER BY a DESC LIMIT 4)
ORDER BY a LIMIT 7;
a
15
16
17
18
19
21
22
(SELECT * FROM t1 ORDER BY a DESC LIMIT 5 OFFSET 4) UNION ALL
(SELECT * FROM t2 ORDER BY a DESC LIMIT 4 OFFSET 2)
ORDER BY a LIMIT 7 OFFSET 1;
a
11
12
13
14
15
21
22
DROP TABLE t1, t2;
create table t1 (a int not null default 0 primary key, b int not null default 0);
insert into t1 () values ();
insert into t1 values (1,1),(2,1),(3,1);
update t1 set a=4 where b=1 limit 1;
select * from t1;
a	b
0	0
2	1
3	1
4	1
update t1 set b=2 where b=1 limit 2;
select * from t1;
a	b
0	0
2	2
3	2
4	1
update t1 set b=4 where b=1;
select * from t1;
a	b
0	0
2	2
3	2
4	4
delete from t1 where b=2 limit 1;
select * from t1;
a	b
0	0
3	2
4	4
delete from t1 limit 1;
select * from t1;
a	b
3	2
4	4
drop table t1;
create table t1 (i int);
insert into t1 (i) values(1),(1),(1);
delete from t1 limit 1;
update t1 set i=2 limit 1;
delete from t1 limit 0;
update t1 set i=3 limit 0;
select * from t1;
i
2
1
drop table t1;
select 0 limit 0;
0
create table t1 (a integer);
insert into t1 values (1);
select 1 as a from t1 union all select 1 from dual limit 1;
a
1
(select 1 as a from t1) union all (select 1 from dual) limit 1;
a
1
drop table t1;
create table t1 (a int);
insert into t1 values (1),(2),(3),(4),(5),(6),(7);
select count(*) c FROM t1 WHERE a > 0 ORDER BY c LIMIT 3;
c
7
select sum(a) c FROM t1 WHERE a > 0 ORDER BY c LIMIT 3;
c
28
drop table t1;
End of 5.0 tests
select 1 as a limit 4294967296,10;
a
End of 5.1 tests
# Bug #28961843: COUNT() WITH LIMIT AND OFFSET RETURNS WRONG RESULT
CREATE TABLE t1 (i INT);
INSERT INTO t1 VALUES (1);
SELECT COUNT(*) FROM t1 LIMIT 1 OFFSET 3;
COUNT(NULL)
DROP TABLE t1;
#
# Bug #29148115: SIG 6 IN TEMPTABLE::RESULT TEMPTABLE::HANDLER::INDEX_NEXT_CONDITIONAL
#
CREATE TABLE t1 (pk INTEGER PRIMARY KEY);
INSERT INTO t1 VALUES (1);
SELECT t1.pk FROM (SELECT DISTINCT * FROM t1) AS t1 WHERE t1.pk=1 LIMIT 1 OFFSET 2;
pk
DROP TABLE t1;
#
# Bug #29373972: SIG 6 AT HANDLER::START_PSI_BATCH_MODE()
#
#
# Bug#29531472: SIG 6 AT JOIN::TEST_SKIP_SORT | SQL_OPTIMIZER.CC
#
CREATE TABLE t1 (
col_int_key INT DEFAULT NULL,
col_varchar_key VARCHAR(1) DEFAULT NULL,
KEY idx_CC_col_int_key (col_int_key),
KEY idx_CC_col_varchar_key (col_varchar_key)
);
INSERT INTO t1 VALUES(1,'A');
SELECT col_varchar_key AS f1
FROM t1
WHERE (col_int_key NOT BETWEEN 10 AND 15 OR col_varchar_key < '2') AND col_int_key IS NULL
GROUP BY f1 LIMIT 100;
f1
DROP TABLE t1;
#
# Bug#30521803: LIMIT CLAUSE OUTSIDE PARENTHESES CAN SUPPRESS ORDERING
#               CLAUSES INSIDE
#
#
# Bug#30204811 ASSERTION `SELECT_LIMIT > 0' FAILED AT
#              TEST_IF_SKIP_SORT_ORDER
#
