create table t1 (id int);
insert into t1 values (null), (0);
create table t2 (id int);
insert into t2 values (null);
select * from t1, t2 where t1.id = t2.id;
id	id
drop table t1,t2;
create table t1 (
id  integer,
id2 integer not null
);
insert into t1 values(null,0),(1,1);
select * from t1;
id	id2
NULL	0
1	1
select * from t1 where id <=> null;
id	id2
NULL	0
select * from t1 where id <=> null or id > 0;
id	id2
NULL	0
1	1
select * from t1 where id is null or id > 0;
id	id2
NULL	0
1	1
select * from t1 where id2 <=> null or id2 > 0;
id	id2
1	1
select * from t1 where id2 is null or id2 > 0;
id	id2
1	1
delete from t1 where id <=> NULL;
select * from t1;
id	id2
1	1
drop table t1;
CREATE TABLE t1 (a int);
CREATE TABLE t2 (a int, b int);
CREATE TABLE t3 (b int);
INSERT INTO t1 VALUES (1), (2), (3), (4);
INSERT INTO t2 VALUES (1, 1), (3, 1);
INSERT INTO t3 VALUES (NULL), (NULL), (NULL), (NULL), (NULL);
INSERT INTO t3 VALUES (NULL), (NULL), (NULL), (NULL), (NULL);
INSERT INTO t3 VALUES (2), (3);
SELECT COUNT(*) FROM t3;
COUNT(NULL)
12
SELECT * FROM t1 LEFT JOIN t2 ON t1.a=t2.a
LEFT JOIN t3 ON t2.b=t3.b;
a	a	b	b
1	1	1	NULL
2	NULL	NULL	NULL
3	3	1	NULL
4	NULL	NULL	NULL
DROP TABLE t1,t2,t3;
CREATE TABLE t1 (
a int default NULL,
b int default NULL
);
INSERT INTO t1 VALUES (0,10),(0,11),(0,12);
CREATE TABLE t2 (
a int default NULL,
b int default NULL
);
INSERT INTO t2 VALUES (3,NULL),(3,11),(3,12);
SELECT * FROM t2 inner join t1 WHERE ( t1.a = 0 OR t1.a IS NULL) AND t2.a = 3 AND t2.b = t1.b;
a	b	a	b
3	11	0	11
3	12	0	12
drop table t1, t2;
CREATE TABLE t1 (a INT);
INSERT INTO t1 VALUES (1), (2), (NULL);
SELECT a FROM t1 WHERE a IN (42) OR (a=NULL);
a
drop table t1;
# End of null_key tests
