DROP TABLE IF EXISTS t1;
CREATE TABLE t1 (sint8 TINYINT NOT NULL);
INSERT INTO t1 VALUES ('0');
INSERT INTO t1 VALUES ('1');
INSERT INTO t1 VALUES ('127');
INSERT INTO t1 VALUES ('-1');
INSERT INTO t1 VALUES ('-127');
INSERT INTO t1 VALUES ('-128');
SELECT * FROM t1 ORDER BY sint8;
sint8
-128
-127
-1
0
1
127
DROP TABLE t1;
CREATE TABLE t1 (uint8 TINYINT UNSIGNED NOT NULL);
INSERT INTO t1 VALUES ('0');
INSERT INTO t1 VALUES ('1');
INSERT INTO t1 VALUES ('127');
INSERT INTO t1 VALUES ('255');
SELECT * FROM t1 ORDER BY uint8;
uint8
0
1
127
255
DROP TABLE t1;
CREATE TABLE t1 (sint16 SMALLINT NOT NULL);
INSERT INTO t1 VALUES ('0');
INSERT INTO t1 VALUES ('1');
INSERT INTO t1 VALUES ('32767');
INSERT INTO t1 VALUES ('-1');
INSERT INTO t1 VALUES ('-32767');
INSERT INTO t1 VALUES ('-32768');
SELECT * FROM t1 ORDER BY sint16;
sint16
-32768
-32767
-1
0
1
32767
DROP TABLE t1;
CREATE TABLE t1 (uint16 SMALLINT UNSIGNED NOT NULL);
INSERT INTO t1 VALUES ('0');
INSERT INTO t1 VALUES ('1');
INSERT INTO t1 VALUES ('32767');
INSERT INTO t1 VALUES ('65535');
SELECT * FROM t1 ORDER BY uint16;
uint16
0
1
32767
65535
DROP TABLE t1;
CREATE TABLE t1 (sint32 INT NOT NULL);
INSERT INTO t1 VALUES ('0');
INSERT INTO t1 VALUES ('1');
INSERT INTO t1 VALUES ('2147483647');
INSERT INTO t1 VALUES ('-1');
INSERT INTO t1 VALUES ('-2147483647');
INSERT INTO t1 VALUES ('-2147483648');
SELECT * FROM t1 ORDER BY sint32;
sint32
-2147483648
-2147483647
-1
0
1
2147483647
DROP TABLE t1;
CREATE TABLE t1 (sint64 BIGINT NOT NULL);
INSERT INTO t1 VALUES ('0');
INSERT INTO t1 VALUES ('1');
INSERT INTO t1 VALUES ('9223372036854775807');
INSERT INTO t1 VALUES ('-1');
INSERT INTO t1 VALUES ('-9223372036854775807');
INSERT INTO t1 VALUES ('-9223372036854775808');
SELECT * FROM t1 ORDER BY sint64;
sint64
-9223372036854775808
-9223372036854775807
-1
0
1
9223372036854775807
DROP TABLE t1;
CREATE TABLE t1 (uint64 BIGINT UNSIGNED NOT NULL);
INSERT INTO t1 VALUES ('0');
INSERT INTO t1 VALUES ('1');
INSERT INTO t1 VALUES ('9223372036854775807');
INSERT INTO t1 VALUES ('18446744073709551615');
SELECT * FROM t1 ORDER BY uint64;
uint64
0
1
9223372036854775807
18446744073709551615
DROP TABLE t1;
CREATE TABLE t1 (str VARCHAR(128), sint64 BIGINT NOT NULL DEFAULT 0);
INSERT INTO t1 (str) VALUES ('2');
INSERT INTO t1 (str) VALUES ('10');
INSERT INTO t1 (str) VALUES ('100');
UPDATE t1 SET sint64 = str;
SELECT * FROM t1 ORDER BY sint64;
str	sint64
2	2
10	10
100	100
DROP TABLE t1;
SELECT ROUND(4054410556, -10);
ROUND(4054410556,-10)
0
