DROP TABLE IF EXISTS t1, t2, t3;
CREATE TABLE t1 (id INT NOT NULL PRIMARY KEY, val INT NOT NULL, grp VARCHAR(10));
INSERT INTO t1 VALUES (1, 10, 'A'), (2, 20, 'A'), (3, 30, 'B'),
(4, 40, 'B'), (5, 50, 'C');
CREATE TABLE t2 (id INT NOT NULL PRIMARY KEY, ref_id INT NOT NULL, amount DECIMAL(10,2));
INSERT INTO t2 VALUES (1, 1, 100.00), (2, 2, 200.00), (3, 3, 150.00),
(4, 4, 250.00), (5, 5, 300.00);
CREATE TABLE t3 (id INT NOT NULL PRIMARY KEY, category VARCHAR(10), active INT NOT NULL);
INSERT INTO t3 VALUES (1, 'A', 1), (2, 'B', 1), (3, 'C', 0);
# --- Multiple independent scalar subqueries in SELECT ---
SELECT (SELECT MIN(val) FROM t1) AS min_v,
(SELECT MAX(val) FROM t1) AS max_v,
(SELECT COUNT(*) FROM t1) AS cnt,
(SELECT SUM(val) FROM t1) AS total;
min_v	max_v	cnt	total
10	50	5	150
# --- Multiple independent scalar subqueries in WHERE ---
SELECT id, val FROM t1
WHERE val > (SELECT MIN(val) FROM t1)
AND val < (SELECT MAX(val) FROM t1)
ORDER BY id;
id	val
2	20
3	30
4	40
SELECT id, val FROM t1
WHERE val = (SELECT MIN(val) FROM t1)
OR val = (SELECT MAX(val) FROM t1)
ORDER BY id;
id	val
1	10
5	50
SELECT id, val FROM t1
WHERE val > (SELECT MIN(val) FROM t1)
AND val < (SELECT MAX(val) FROM t1)
AND val <> (SELECT AVG(val) FROM t1)
ORDER BY id;
id	val
2	20
4	40
# --- Scalar subquery in SELECT + different scalar subquery in WHERE ---
SELECT id, val, (SELECT MAX(val) FROM t1) AS max_v
FROM t1 WHERE val > (SELECT MIN(val) FROM t1) ORDER BY id;
id	val	max_v
2	20	50
3	30	50
4	40	50
5	50	50
SELECT id, val, (SELECT SUM(amount) FROM t2) AS total_amount
FROM t1 WHERE val >= (SELECT AVG(val) FROM t1) ORDER BY id;
id	val	total_amount
3	30	1000
4	40	1000
5	50	1000
# --- IN subquery combined with scalar subquery ---
SELECT id, val FROM t1
WHERE grp IN (SELECT category FROM t3 WHERE active = 1)
AND val > (SELECT AVG(val) FROM t1)
ORDER BY id;
id	val
4	40
SELECT id, val FROM t1
WHERE val NOT IN (SELECT ref_id FROM t2)
AND val >= (SELECT MIN(val) FROM t1)
ORDER BY id;
id	val
1	10
2	20
3	30
4	40
5	50
# --- Subquery inside derived table ---
SELECT * FROM (
SELECT id, val FROM t1 WHERE val > (SELECT AVG(val) FROM t1)
) d ORDER BY d.id;
id	val
4	40
5	50
SELECT * FROM (
SELECT id, val FROM t1 WHERE grp IN (SELECT category FROM t3 WHERE active = 1)
) d ORDER BY d.id;
id	val
1	10
2	20
3	30
4	40
SELECT d.grp, d.total FROM (
SELECT grp, SUM(val) AS total FROM t1 GROUP BY grp
) d
WHERE d.total > (SELECT AVG(val) FROM t1)
ORDER BY d.grp;
grp	total
B	70
C	50
# --- Derived table with IN subquery in outer WHERE ---
SELECT d.grp, d.total FROM (
SELECT grp, SUM(val) AS total FROM t1
WHERE grp IN (SELECT category FROM t3 WHERE active = 1)
GROUP BY grp
) d ORDER BY d.grp;
grp	total
A	30
B	70
# --- Comparison with subqueries on both sides ---
SELECT (SELECT MIN(val) FROM t1) < (SELECT MAX(val) FROM t1);
(SELECT ...) < (SELECT ...)
1
SELECT (SELECT MIN(val) FROM t1) = (SELECT MAX(val) FROM t1);
(SELECT ...) = (SELECT ...)
0
SELECT (SELECT COUNT(*) FROM t1) >= (SELECT COUNT(*) FROM t2);
(SELECT ...) >= (SELECT ...)
1
SELECT (SELECT SUM(val) FROM t1) > (SELECT SUM(amount) FROM t2);
(SELECT ...) > (SELECT ...)
0
# --- Subquery in HAVING with separate subquery in WHERE ---
SELECT grp, COUNT(*) AS cnt, SUM(val) AS total FROM t1
WHERE val > (SELECT MIN(val) FROM t1)
GROUP BY grp
HAVING COUNT(*) >= (SELECT 2)
ORDER BY grp;
grp	cnt	total
B	2	70
# --- IN subquery in SELECT list + IN subquery in WHERE ---
SELECT id, val,
val IN (SELECT ref_id FROM t2) AS is_ref
FROM t1
WHERE grp IN (SELECT category FROM t3 WHERE active = 1)
ORDER BY id;
id	val	is_ref
1	10	0
2	20	0
3	30	0
4	40	0
# --- Subquery result used in expression ---
SELECT id, val,
val - (SELECT AVG(val) FROM t1) AS diff_avg,
val * 100 / (SELECT SUM(val) FROM t1) AS pct
FROM t1 ORDER BY id;
id	val	diff_avg	pct
1	10	-20	6.666666666666667
2	20	-10	13.333333333333334
3	30	0	20
4	40	10	26.666666666666668
5	50	20	33.333333333333336
# --- Multi-table join with independent subquery filter ---
SELECT t1.id, t1.val, t2.amount
FROM t1 JOIN t2 ON t1.id = t2.ref_id
WHERE t1.val > (SELECT AVG(val) FROM t1)
ORDER BY t1.id;
id	val	amount
4	40	250.00
5	50	300.00
SELECT t1.id, t1.val, t2.amount
FROM t1 JOIN t2 ON t1.id = t2.ref_id
WHERE t2.amount IN (SELECT amount FROM t2 WHERE amount > 200)
ORDER BY t1.id;
id	val	amount
4	40	250.00
5	50	300.00
# --- INSERT ... SELECT with subquery ---
CREATE TABLE t4 (id INT NOT NULL PRIMARY KEY, val INT NOT NULL);
INSERT INTO t4 SELECT id, val FROM t1
WHERE val > (SELECT AVG(val) FROM t1);
SELECT * FROM t4 ORDER BY id;
id	val
4	40
5	50
DROP TABLE t4;
# --- UPDATE with scalar subquery ---
UPDATE t1 SET val = 99 WHERE id = (SELECT MAX(id) FROM t1);
SELECT * FROM t1 ORDER BY id;
id	val	grp
1	10	A
2	20	A
3	30	B
4	40	B
5	99	C
# --- DELETE with IN subquery ---
DELETE FROM t1 WHERE grp IN (SELECT category FROM t3 WHERE active = 0);
SELECT * FROM t1 ORDER BY id;
id	val	grp
1	10	A
2	20	A
3	30	B
4	40	B
# --- Truly nested subqueries (subquery inside subquery) ---
SELECT (SELECT MAX(val) FROM t1 WHERE val > (SELECT MIN(val) FROM t1));
(SELECT ...)
40
SELECT id, val FROM t1
WHERE val > (SELECT AVG(val) FROM t1 WHERE val > (SELECT MIN(val) FROM t1))
ORDER BY id;
id	val
4	40
SELECT (SELECT MAX(val) FROM t1 WHERE val > (SELECT AVG(val) FROM t1 WHERE val > (SELECT MIN(val) FROM t1)));
(SELECT ...)
40
SELECT id, val FROM t1
WHERE val IN (SELECT val FROM t1 WHERE val > (SELECT AVG(val) FROM t1))
ORDER BY id;
id	val
3	30
4	40
# --- Cleanup ---
DROP TABLE t1, t2, t3;
