DROP TABLE IF EXISTS t1, t2;
CREATE TABLE t1 (c INT NOT NULL, d CHAR(10) NOT NULL);
INSERT INTO t1 VALUES (1,''),(2,'a'),(3,'b');
SELECT * FROM t1 ORDER BY c;
c	d
1	
2	a
3	b
DROP TABLE t1;
CREATE TABLE t1 (pkCrash INT PRIMARY KEY, strCrash VARCHAR(255));
INSERT INTO t1 (pkCrash, strCrash) VALUES (1, '1');
SELECT CONCAT_WS(pkCrash, strCrash) FROM t1;
CONCAT_WS(pkCrash,strCrash)
1
DROP TABLE t1;
CREATE TABLE t1 (x INT);
INSERT INTO t1 VALUES (1), (2), (3);
SELECT * FROM t1 ORDER BY x;
x
1
2
3
DROP TABLE t1;
CREATE TABLE t1 (a INT, b INT);
INSERT INTO t1 VALUES (3,1),(3,2);
CREATE TABLE t2 (c INT PRIMARY KEY, d VARCHAR(255));
INSERT INTO t2 VALUES (1, 'foo'), (2, 'bar');
SELECT d, c FROM t1 LEFT JOIN t2 ON b = c WHERE a = 3 ORDER BY d;
d	c
bar	2
foo	1
DROP TABLE t1, t2;
CREATE TABLE t1 (c INT);
INSERT INTO t1 VALUES (12139);
CREATE TABLE t2 (c INT);
INSERT INTO t2 VALUES (123456);
SELECT AVG(c) FROM t1 UNION SELECT 1;
AVG(c)
12139
1
SELECT 1 UNION SELECT AVG(c) FROM t1;
1
1
12139
SELECT 1 UNION SELECT * FROM t2 UNION SELECT 1;
1
1
123456
SELECT c / 1 FROM t1 UNION SELECT 1;
c / 1
12139
1
DROP TABLE t1, t2;
CREATE TABLE t1 (a INT);
INSERT INTO t1 VALUES (4711);
SELECT * FROM t1;
a
4711
TRUNCATE t1;
INSERT INTO t1 VALUES (42);
SELECT * FROM t1;
a
42
DROP TABLE t1;
CREATE TABLE t1 (a INT, b VARCHAR(20));
INSERT INTO t1 VALUES (1, 'val1'), (2, 'val2'), (3, 'val3');
DELETE FROM t1 WHERE a = 1;
SELECT COUNT(*) FROM t1;
COUNT(NULL)
2
DELETE FROM t1;
SELECT * FROM t1;
a	b
DROP TABLE t1;
CREATE TABLE t1 (a INT, b INT);
INSERT INTO t1 VALUES (1,2),(3,4);
CREATE TABLE t2 (a INT, b INT);
INSERT INTO t2 VALUES (1,2);
INSERT INTO t2 VALUES (4,5);
SELECT * FROM (SELECT COUNT(DISTINCT t1.a) AS cnt, t1.b FROM t1 RIGHT JOIN t2 ON t1.a = t2.a GROUP BY t1.b) AS tt ORDER BY tt.b;
cnt	b
0	NULL
1	2
DROP TABLE t1, t2;
CREATE TABLE t1 (a INT);
INSERT INTO t1 VALUES (1), (2), (3);
SELECT * FROM t1 ORDER BY a;
a
1
2
3
SELECT COUNT(*) FROM t1;
COUNT(NULL)
3
SELECT SUM(a) FROM t1;
SUM(a)
6
SELECT AVG(a) FROM t1;
AVG(a)
2
SELECT MIN(a) FROM t1;
MIN(a)
1
SELECT MAX(a) FROM t1;
MAX(a)
3
DROP TABLE t1;
CREATE TABLE t1 (
a VARCHAR(255) NOT NULL,
b VARCHAR(255) NOT NULL,
c VARCHAR(255),
d VARCHAR(255) NOT NULL,
PRIMARY KEY (a, b, d)
);
INSERT INTO t1 (a, b, c, d) VALUES ('1','4',NULL,'3'),('2','5',NULL,'4');
SELECT * FROM t1 ORDER BY a;
a	b	c	d
1	4	NULL	3
2	5	NULL	4
DROP TABLE t1;
