DROP TABLE IF EXISTS t1;
CREATE TABLE t1 (a integer, b integer, c1 CHAR(10));
INSERT INTO t1 (a) VALUES (1),(2);
TRUNCATE TABLE t1;
SELECT count(*) FROM t1;
COUNT(NULL)
0
INSERT INTO t1 VALUES(1,2,"test");
SELECT count(*) FROM t1;
COUNT(NULL)
1
DELETE FROM t1;
SELECT * FROM t1;
a	b	c1
DROP TABLE t1;
SELECT count(*) FROM t1;
ERROR 42S02: Table 't1' not found
TRUNCATE non_existing_table;
ERROR 42S02: Table 'non_existing_table' not found
CREATE TABLE t1 (a integer NOT NULL PRIMARY KEY);
INSERT INTO t1 (a) VALUES (1),(2);
TRUNCATE TABLE t1;
INSERT INTO t1 (a) VALUES (1),(2);
SELECT * FROM t1;
a
1
2
DELETE FROM t1;
INSERT INTO t1 (a) VALUES (1),(2);
SELECT * FROM t1;
a
1
2
DROP TABLE t1;
CREATE TABLE t1 (a INT);
INSERT INTO t1 VALUES (1), (2), (3);
SELECT * FROM t1;
a
1
2
3
TRUNCATE TABLE t1;
SELECT * FROM t1;
a
DROP TABLE t1;
