drop table if exists t1,t2,t3;
CREATE TABLE t1 (
id int NOT NULL,
string char(10) default "hello",
tiny tinyint DEFAULT '0' NOT NULL,
short smallint DEFAULT '1' NOT NULL,
long_int int DEFAULT '0' NOT NULL,
longlong bigint DEFAULT '0' NOT NULL,
real_float float DEFAULT 0.0 NOT NULL,
real_double double,
utiny tinyint unsigned DEFAULT '0' NOT NULL,
ushort smallint unsigned DEFAULT '0' NOT NULL,
ulong int unsigned DEFAULT '0' NOT NULL,
ulonglong bigint unsigned DEFAULT '0' NOT NULL,
date_field date,
time_field time,
date_time datetime,
blob_col blob,
PRIMARY KEY (id)
);
insert into t1 values (10, 'hi',1,1,1,1,1.0,1.0,1,1,1,1,'2024-01-01','10:10:10','2024-01-01 10:10:10','blob1');
insert into t1 values (20, NULL,2,2,2,2,2.0,2.0,2,2,2,2,NULL,NULL,NULL,NULL);
insert into t1 values (30, 'test',1,3,3,3,3.0,3.0,3,3,3,3,'2024-03-03','10:10:10','2024-03-03 10:10:10','blob3');
insert into t1 (id, tiny) values (40, 1);
select id,string,tiny,short,long_int,longlong,real_float,real_double,utiny,ushort,ulong,ulonglong,date_field,time_field,date_time,blob_col from t1;
id	string	tiny	short	long_int	longlong	real_float	real_double	utiny	ushort	ulong	ulonglong	date_field	time_field	date_time	blob_col
10	hi	1	1	1	1	1	1	1	1	1	1	2024-01-01	10:10:10	2024-01-01 10:10:10	blob1
20	NULL	2	2	2	2	2	2	2	2	2	2	NULL	NULL	NULL	NULL
30	test	1	3	3	3	3	3	3	3	3	3	2024-03-03	10:10:10	2024-03-03 10:10:10	blob3
40	NULL	1	1	0	0	0	NULL	0	0	0	0	NULL	NULL	NULL	NULL
select * from t1 where tiny > 0;
id	string	tiny	short	long_int	longlong	real_float	real_double	utiny	ushort	ulong	ulonglong	date_field	time_field	date_time	blob_col
10	hi	1	1	1	1	1	1	1	1	1	1	2024-01-01	10:10:10	2024-01-01 10:10:10	blob1
20	NULL	2	2	2	2	2	2	2	2	2	2	NULL	NULL	NULL	NULL
30	test	1	3	3	3	3	3	3	3	3	3	2024-03-03	10:10:10	2024-03-03 10:10:10	blob3
40	NULL	1	1	0	0	0	NULL	0	0	0	0	NULL	NULL	NULL	NULL
select * from t1 where tiny between 1 and 2;
id	string	tiny	short	long_int	longlong	real_float	real_double	utiny	ushort	ulong	ulonglong	date_field	time_field	date_time	blob_col
10	hi	1	1	1	1	1	1	1	1	1	1	2024-01-01	10:10:10	2024-01-01 10:10:10	blob1
20	NULL	2	2	2	2	2	2	2	2	2	2	NULL	NULL	NULL	NULL
30	test	1	3	3	3	3	3	3	3	3	3	2024-03-03	10:10:10	2024-03-03 10:10:10	blob3
40	NULL	1	1	0	0	0	NULL	0	0	0	0	NULL	NULL	NULL	NULL
select * from t1 where string is null;
id	string	tiny	short	long_int	longlong	real_float	real_double	utiny	ushort	ulong	ulonglong	date_field	time_field	date_time	blob_col
20	NULL	2	2	2	2	2	2	2	2	2	2	NULL	NULL	NULL	NULL
40	NULL	1	1	0	0	0	NULL	0	0	0	0	NULL	NULL	NULL	NULL
select * from t1 where string is not null;
id	string	tiny	short	long_int	longlong	real_float	real_double	utiny	ushort	ulong	ulonglong	date_field	time_field	date_time	blob_col
10	hi	1	1	1	1	1	1	1	1	1	1	2024-01-01	10:10:10	2024-01-01 10:10:10	blob1
30	test	1	3	3	3	3	3	3	3	3	3	2024-03-03	10:10:10	2024-03-03 10:10:10	blob3
update t1 set string='updated' where id=10;
select id,string from t1 where id=10;
id	string
10	updated
delete from t1 where id=40;
select count(*) from t1;
COUNT(NULL)
3
drop table t1;
CREATE TABLE t1 (
a tinyint,
b smallint,
c int,
d bigint,
e tinyint unsigned,
f smallint unsigned,
g int unsigned,
h bigint unsigned
);
INSERT INTO t1 VALUES (-128, -32768, -2147483648, -9223372036854775808, 0, 0, 0, 0);
INSERT INTO t1 VALUES (127, 32767, 2147483647, 9223372036854775807, 255, 65535, 4294967295, 18446744073709551615);
SELECT * FROM t1;
a	b	c	d	e	f	g	h
-128	-32768	-2147483648	-9223372036854775808	0	0	0	0
127	32767	2147483647	9223372036854775807	255	65535	4294967295	18446744073709551615
DROP TABLE t1;
create table t1 (id int, val varchar(10));
create table t2 (id int, val varchar(10));
insert into t1 values (1, 'a'), (2, 'b'), (3, 'c');
insert into t2 values (1, 'x'), (3, 'z');
select t1.id, t1.val, t2.val from t1 left join t2 on t1.id = t2.id order by t1.id;
id	val	val
1	a	x
2	b	NULL
3	c	z
drop table t1, t2;
