CREATE TABLE t1 (
id int NOT NULL,
min_value decimal(20,10) DEFAULT '0.0000000000' NOT NULL,
max_value decimal(20,10) DEFAULT '0.0000000000' NOT NULL,
PRIMARY KEY (id)
);
INSERT INTO t1 VALUES (1, '0.0000000000', '0.0000000000');
INSERT INTO t1 VALUES (2, '1.0000000000', '1.0000000000');
INSERT INTO t1 VALUES (3, '2.0000000000', '49.0000000000');
INSERT INTO t1 VALUES (4, '-35.0000000000', '-5.0000000000');
INSERT INTO t1 VALUES (5, '-4.9000000000', '-0.1000000000');
SELECT * FROM t1 WHERE min_value <= 1 AND max_value >= -1;
id	min_value	max_value
1	0.0000000000	0.0000000000
2	1.0000000000	1.0000000000
5	-4.9000000000	-0.1000000000
SELECT * FROM t1 WHERE min_value <= -1 AND max_value >= -1;
id	min_value	max_value
5	-4.9000000000	-0.1000000000
DROP TABLE t1;
CREATE TABLE t1 (a decimal(10,2));
INSERT INTO t1 VALUES ("0.0"),("-0.0"),("+0.0"),("01.0"),("+01.0"),("-01.0");
INSERT INTO t1 VALUES ("-.1"),("+.1"),(".1");
INSERT INTO t1 VALUES ("00000000000001"),("+0000000000001"),("-0000000000001");
INSERT INTO t1 VALUES ("+111111111.11"),("111111111.11"),("-11111111.11");
SELECT * FROM t1;
a
0.00
0.00
0.00
1.00
1.00
-1.00
-0.10
0.10
0.10
1.00
1.00
-1.00
111111111.11
111111111.11
-11111111.11
DROP TABLE t1;
CREATE TABLE t1 (a decimal(10,2));
INSERT INTO t1 VALUES (0.0),("-0.0"),(+0.0),(01.0),(+01.0),(-01.0);
INSERT INTO t1 VALUES (-.1),(+.1),(.1);
INSERT INTO t1 VALUES (00000000000001),(+0000000000001),(-0000000000001);
INSERT INTO t1 VALUES (+111111111.11),(111111111.11),(-11111111.11);
SELECT * FROM t1;
a
0.00
0.00
0.00
1.00
1.00
-1.00
-0.10
0.10
0.10
1.00
1.00
-1.00
111111111.11
111111111.11
-11111111.11
DROP TABLE t1;
CREATE TABLE t1 (a decimal);
INSERT INTO t1 VALUES (-99999999999999),(-1),('+1'),('01'),('+00000000000001'),('+12345678901'),(99999999999999);
SELECT * FROM t1;
a
-99999999999999
-1
1
1
1
12345678901
99999999999999
DROP TABLE t1;
CREATE TABLE t1 (a decimal(10,5), b decimal(10,1));
INSERT INTO t1 VALUES (123.12345, 123.12345);
UPDATE t1 SET b = a;
SELECT * FROM t1;
a	b
123.12345	123.12345
DROP TABLE t1;
CREATE TABLE t1 (d decimal(64,0));
INSERT INTO t1 VALUES (1);
SELECT * FROM t1;
d
1
DROP TABLE t1;
CREATE TABLE t1 (i INT, d1 DECIMAL(9,2), d2 DECIMAL(9,2));
INSERT INTO t1 VALUES (1, 101.40, 21.40), (1, -80.00, 0.00),
(2, 0.00, 0.00), (2, -13.20, 0.00), (2, 59.60, 46.40),
(2, 30.40, 30.40), (3, 37.00, 7.40), (3, -29.60, 0.00),
(4, 60.00, 15.40), (4, -10.60, 0.00), (4, -34.00, 0.00),
(5, 33.00, 0.00), (5, -25.80, 0.00), (5, 0.00, 7.20),
(6, 0.00, 0.00), (6, -51.40, 0.00);
SELECT i, SUM(d1) AS a, SUM(d2) AS b FROM t1 GROUP BY i HAVING a <> b;
i	a	b
SELECT i, ROUND(SUM(d1), 2) AS a, ROUND(SUM(d2), 2) AS b FROM t1 GROUP BY i
HAVING a <> b;
i	a	b
DROP TABLE t1;
SELECT 1.5 + 2.5;
1.5 + 2.5
4
SELECT 10.0 - 3.5;
10 - 3.5
6.5
SELECT 2.5 * 4.0;
2.5 * 4
10
SELECT 10.0 / 3.0;
10 / 3
3.333333333333333
SELECT CAST(1.5 AS DECIMAL(10,2)) = CAST(1.50 AS DECIMAL(10,2));
CAST(1.5 AS DECIMAL(10,2)) = CAST(1.5 AS DECIMAL(10,2))
1
SELECT CAST(1.5 AS DECIMAL(10,2)) < CAST(2.50 AS DECIMAL(10,2));
CAST(1.5 AS DECIMAL(10,2)) < CAST(2.5 AS DECIMAL(10,2))
1
SELECT CAST(3.0 AS DECIMAL(10,2)) > CAST(2.50 AS DECIMAL(10,2));
CAST(3 AS DECIMAL(10,2)) > CAST(2.5 AS DECIMAL(10,2))
1
