SELECT 10,10.0,10.,.1e+2,100.0e-1;
10	10.0	10	10	10
10	10.0	10	10	10
SELECT 6e-16, -6e-16, --6e-16, -6e-16+1.000000;
0.0000000000000006	-0.0000000000000006	--0.0000000000000006	-0.0000000000000006 + 1.000000
6e-16	-6e-16	6e-16	0.999999999999999
SELECT 1e1,1.e1,1.0e1,1e+1,1.e+1,1.0e+1,1e-1,1.e-1,1.0e-1;
10	10	10	10	10	10	0.1	0.1	0.1
10	10	10	10	10	10	0.1	0.1	0.1
SELECT 0.001e+1,0.001e-1, -0.001e+01,-0.001e-01;
0.01	0.0001	-0.01	-0.0001
0.01	0.0001	-0.01	-0.0001
SELECT 123.23E+02,-123.23E-02,"123.23E+02"+0.0,"-123.23E-02"+0.0;
12323	-1.2323	'123.23E+02' + 0.0	'-123.23E-02' + 0.0
12323	-1.2323	12323	-1.2323
SELECT 2147483647E+02,21474836.47E+06;
214748364700	21474836470000
214748364700	21474836470000
create table t1 (datum double);
insert into t1 values (0.5),(1.0),(1.5),(2.0),(2.5);
select * from t1;
datum
0.5
1
1.5
2
2.5
select * from t1 where datum < 1.5;
datum
0.5
1
select * from t1 where datum > 1.5;
datum
2
2.5
select * from t1 where datum = 1.5;
datum
1.5
drop table t1;
create table t1 (a  decimal(7,3) not null, key (a));
insert into t1 values ("0"),("-0.00"),("-0.01"),("-0.002"),("1");
select a from t1 order by a;
a
-0.010
-0.002
0.000
0.000
1.000
select min(a) from t1;
MIN(a)
-0.010
drop table t1;
create table t1 (c1 double, c2 varchar(20));
insert into t1 values (121,"16");
select c1 + c1 * (c2 / 100) as col from t1;
col
140.360000000000014
drop table t1;
create table t1 (a float);
insert into t1 values (1);
select max(a),min(a),avg(a) from t1;
MAX(a)	MIN(a)	AVG(a)
1	1	1
drop table t1;
create table t1 (a  decimal(7,3) not null, key (a));
insert into t1 values ("0"),("-0.00"),("-0.01"),("-0.002"),("1");
select a from t1 order by a;
a
-0.010
-0.002
0.000
0.000
1.000
select min(a) from t1;
MIN(a)
-0.010
drop table t1;
create table t1 (a float(200,100), b double(200,100));
ERROR 42000: Invalid operation: Display width out of range for column (max = 255)
create table t1 (c20 char);
insert into t1 values (5000.0);
insert into t1 values (0.5e4);
drop table t1;
create table t1 (f float(54));
ERROR 42000: Invalid operation: Incorrect column specifier
drop table if exists t1;
create table t1 (d1 double, d2 double unsigned);
insert into t1 set d1 = -1.0;
update t1 set d2 = d1;
select * from t1;
d1	d2
-1	-1
drop table t1;
create table t1 (f float(4,3));
insert into t1 values (-11.0),(-11),("-11"),(11.0),(11),("11");
select * from t1;
f
-11
-11
-11
11
11
11
drop table if exists t1;
create table t1 (f double(4,3));
insert into t1 values (-11.0),(-11),("-11"),(11.0),(11),("11");
select * from t1;
f
-11
-11
-11
11
11
11
drop table if exists t1;
create table t1 (c char(20));
insert into t1 values (5e-28);
select * from t1;
c
0.0000000000000000000000000005
drop table t1;
create table t1 (c char(6));
insert into t1 values (2e5),(2e6),(2e-4),(2e-5);
select * from t1;
c
200000.0
2000000.0
0.0002
0.00002
drop table t1;
select 1e-308, 1.00000001e-300, 100000000e-300;
0.00000000000000000000000000000000000000000000000000000000000000000000000000000000000000000000000000000000000000000000000000000000000000000000000000000000000000000000000000000000000000000000000000000000000000000000000000000000000000000000000000000000000000000000000000000000000000000000000000000000000000000001	0.00000000000000000000000000000000000000000000000000000000000000000000000000000000000000000000000000000000000000000000000000000000000000000000000000000000000000000000000000000000000000000000000000000000000000000000000000000000000000000000000000000000000000000000000000000000000000000000000000000000000100000001	0.0000000000000000000000000000000000000000000000000000000000000000000000000000000000000000000000000000000000000000000000000000000000000000000000000000000000000000000000000000000000000000000000000000000000000000000000000000000000000000000000000000000000000000000000000000000000000000000000000001
1e-308	1.00000001e-300	1e-292
select 10e307;
100000000000000000000000000000000000000000000000000000000000000000000000000000000000000000000000000000000000000000000000000000000000000000000000000000000000000000000000000000000000000000000000000000000000000000000000000000000000000000000000000000000000000000000000000000000000000000000000000000000000000000000
1e308
create table t1 (c char(6));
insert into t1 values (2e6),(2e-5);
select * from t1;
c
2000000.0
0.00002
drop table t1;
create table t1 (a char(20));
insert into t1 values (1.225e-05);
select a+0 from t1;
a + 0
0.00001225
drop table t1;
create table t1(d double, u bigint unsigned);
insert into t1(d) values (9.22337203685479e18),
(1.84e19);
update t1 set u = d;
select u from t1;
u
9223372036854790144
18400000000000000000
drop table t1;
CREATE TABLE t1 (f1 DOUBLE);
INSERT INTO t1 VALUES(-1.79769313486231e+308);
SELECT f1 FROM t1;
f1
-1.79769313486231e308
DROP TABLE t1;
CREATE TABLE t1 (f FLOAT);
INSERT INTO t1 VALUES ('1.');
INSERT INTO t1 VALUES ('2.0.');
INSERT INTO t1 VALUES ('.');
SELECT * FROM t1 ORDER BY f;
f
0
0
1
DROP TABLE t1;
# End of type_float tests
